business_name,gbp_url,business_hours,weekly_hours,rating,review_count,top_review_1,top_review_2,top_review_3
DFW HVAC,https://www.google.com/maps/place/DFW+HVAC/data=!4m7!3m6!1s0x864c2964d3f929a1:0x21c885c9a030a6cb!8m2!3d32.9572397!4d-97.0062923!16s%2Fg%2F11j5dwfcq_!19sChIJoSn502QpTIYRy6YwoMmFyCE?authuser=0&hl=en&rclk=1,Closed · Opens 7 am Mon,Sunday: Closed||Monday: 7 am–6 pm||Tuesday: 7 am–6 pm||Wednesday: 7 am–6 pm||Thursday: 7 am–6 pm||Friday: 7 am–6 pm||Saturday: Closed,5,162,"556 S Coppell Rd Ste 103, Coppell, TX 75019, United States","A malfunctioning thermostat led to a control board replacement and thermostat upgrade, restoring comfort in Coppell.","""Incredible service, worked quickly and a reasonable price!"""
The Right Choice Air Conditioning And Plumbing,https://www.google.com/maps/place/The+Right+Choice+Air+Conditioning+And+Plumbing/data=!4m7!3m6!1s0x864c27c4ecba111d:0x20ecd9db8a107463!8m2!3d32.9257901!4d-96.9035782!16s%2Fg%2F11bby3hlzw!19sChIJHRG67MQnTIYRY3QQitvZ7CA?authuser=0&hl=en&rclk=1,Open 24 hours,Sunday: Open 24 hours||Monday: Open 24 hours||Tuesday: Open 24 hours||Wednesday: Open 24 hours||Thursday: Open 24 hours||Friday: Open 24 hours||Saturday: Open 24 hours,4.8,"1,053",The Right Choice Air Conditioning And Plumbing,"13370 Branchview Ln #160, Farmers Branch, TX 75234, United States","Our location has recently moved too 13370 Branch View Ln, Suite 160, Farmers Branch! Still the same company just moved to a larger location for more storage allowing us to provide better pricing for all of our customers! We look forward to working with you."
"Berkeys Plumbing, A/C & Electrical","https://www.google.com/maps/place/Berkeys+Plumbing,+A%2FC+%26+Electrical/data=!4m7!3m6!1s0x8325e18bf7dcdf57:0xf9fc4a6feb70268e!8m2!3d32.8082992!4d-96.7896229!16s%2Fg%2F11vcsjbq74!19sChIJV9_c94vhJYMRjiZw629K_Pk?authuser=0&hl=en&rclk=1",Open 24 hours,Sunday: Open 24 hours||Monday: Open 24 hours||Tuesday: Open 24 hours||Wednesday: Open 24 hours||Thursday: Open 24 hours||Friday: Open 24 hours||Saturday: Open 24 hours,4.9,"3,336","4311 Belmont Ave Ste 125, Dallas, TX 75204, United States","We've maintained an A+ BBB rating since 1997! Consistent quality, honest service, and customer satisfaction drive everything we do. 50 years strong in North Texas! Join thousands of satisfied customers #TrustedService",Francisco did a fantastic job installing my new AC unit. He and his helper were very professional and very knowledgeable about the system and the process of installing the unit. I’m very pleased with the results and I’m pleased with BERKEYS. I would highly recommend them to anyone who needs service.
AC WIZARD,https://www.google.com/maps/place/AC+WIZARD/data=!4m7!3m6!1s0x864ea0805653ab2b:0xc40fc00fad05092f!8m2!3d32.8958809!4d-96.7099006!16s%2Fg%2F1td3l_p4!19sChIJK6tTVoCgToYRLwkFrQ_AD8Q?authuser=0&hl=en&rclk=1,Closed · Opens 8 am Mon,Sunday: Closed||Monday: 8 am–5 pm||Tuesday: 8 am–5 pm||Wednesday: 8 am–5 pm||Thursday: 8 am–5 pm||Friday: 8 am–5 pm||Saturday: 8 am–12 pm,4.1,194,"10725 Sandhill Rd #105, Dallas, TX 75238, United States","""Choose an honest and professional AC service/installation company folks.""","""We used them through the home warranty, and the work done has not lasted."""
Mission Air Conditioning & Plumbing,https://www.google.com/maps/place/Mission+Air+Conditioning+%26+Plumbing/data=!4m7!3m6!1s0x8640c7b2796e3c3b:0xd27e76550a3912dc!8m2!3d29.8024054!4d-95.5283538!16s%2Fg%2F12qh01hvq!19sChIJOzxuebLHQIYR3BI5ClV2ftI?authuser=0&hl=en&rclk=1,Closed · Opens 7 am Mon,Sunday: Closed||Monday: 7 am–7 pm||Tuesday: 7 am–7 pm||Wednesday: 7 am–7 pm||Thursday: 7 am–7 pm||Friday: 7 am–7 pm||Saturday: 8 am–4 pm,4.8,"2,912","1630 Elmview Dr, Houston, TX 77080, United States","RF2C+XM Northwest Houston, Houston, TX, USA","We completed preventive maintenance on two commercial units in Houston today, performing a full check, tightening a loose blower belt, and replacing four ceiling filters. After our inspection everything was running smoothly and the manager appreciated the quick care. Regular upkeep like this helps keep buildings comfortable and trouble-free."
Air Tech of Houston AC & Plumbing,https://www.google.com/maps/place/Air+Tech+of+Houston+AC+%26+Plumbing/data=!4m7!3m6!1s0x8640c6550750ea9d:0xe40fea0d73798ecb!8m2!3d29.8186339!4d-95.4384587!16s%2Fg%2F1wzt2rtr!19sChIJnepQB1XGQIYRy455cw3qD-Q?authuser=0&hl=en&rclk=1,Open 24 hours,Sunday: Open 24 hours||Monday: Open 24 hours||Tuesday: Open 24 hours||Wednesday: Open 24 hours||Thursday: Open 24 hours||Friday: Open 24 hours||Saturday: Open 24 hours,4.9,"6,124","2114 Lou Ellen Ln, Houston, TX 77018, United States","RH96+FJ Central Northwest, Houston, TX, USA","🌟💵 Special offers are available for a limited time on HVAC, plumbing, and electrical services. Save on repairs, maintenance, and home upgrades before these deals are gone."
Bellaire Air Conditioning,https://www.google.com/maps/place/Bellaire+Air+Conditioning/data=!4m7!3m6!1s0x8640c23d7055ea11:0x6156bd4e5c0e8a8e!8m2!3d29.7151226!4d-95.4750368!16s%2Fg%2F126228s76!19sChIJEepVcD3CQIYRjooOXE69VmE?authuser=0&hl=en&rclk=1,Open 24 hours,Sunday: Open 24 hours||Monday: Open 24 hours||Tuesday: Open 24 hours||Wednesday: Open 24 hours||Thursday: Open 24 hours||Friday: Open 24 hours||Saturday: Open 24 hours,4.9,491,Bellaire Air Conditioning - Schedule Your Service Online,Keep Your Home Comfortable In Any Weather With Expert HVAC Service From Bellaire. Call Us.,"5414 Ashbrook Dr, Houston, TX 77081, United States"
House Pro Air Conditioning,https://www.google.com/maps/place/House+Pro+Air+Conditioning/data=!4m7!3m6!1s0x8640c3ce0f68e721:0x635ebede94309e3d!8m2!3d29.827337!4d-95.4068878!16s%2Fg%2F1w9y1h08!19sChIJIedoD87DQIYRPZ4wlN6-XmM?authuser=0&hl=en&rclk=1,Open 24 hours,Sunday: Open 24 hours||Monday: Open 24 hours||Tuesday: Open 24 hours||Wednesday: Open 24 hours||Thursday: Open 24 hours||Friday: Open 24 hours||Saturday: Open 24 hours,4.7,"1,473","330 Garden Oaks Blvd, Houston, TX 77018, United States","AC Not Cooling? 9 Common Causes Houston Homeowners Should Check First When the Houston sun starts shining down and the heat settles in, it probably won’t take long until you turn to your AC. You go to your thermostat, set it to ‘cool’, and wait a few minutes… no matter how long you wait, though, you’re not feeling the cool air you were expecting. Maybe you’re noticing warm air coming from the vents, or maybe there’s no air at all. No matter the problem, you deserve better; here are nine of the most common AC problems that Houston homeowners should check when their air conditioner isn’t cooling the way it should.","""House pro is a great ac company who give fair prices and really good service."""
Revolution Air,https://www.google.com/maps/place/Revolution+Air/data=!4m7!3m6!1s0x8640c710f8f97a2b:0x4b54a69645e2ec28!8m2!3d29.8021813!4d-95.4233225!16s%2Fg%2F11dy1gvh3n!19sChIJK3r5-BDHQIYRKOziRZamVEs?authuser=0&hl=en&rclk=1,Open 24 hours,Sunday: Open 24 hours||Monday: Open 24 hours||Tuesday: Open 24 hours||Wednesday: Open 24 hours||Thursday: Open 24 hours||Friday: Open 24 hours||Saturday: Open 24 hours,4.8,124,"1300 W 19th St #7827, Houston, TX 77008, United States","""I'm blown away by the service and the prices.""","""If you are looking for quality work, honest diagnosis, and fast work."""
"Master AC and Heat, LLC- The Heights","https://www.google.com/maps/place/Master+AC+and+Heat,+LLC-+The+Heights/data=!4m7!3m6!1s0x8640b8eaa555ba1d:0xca8a9ec797fa69c8!8m2!3d29.796459!4d-95.3723125!16s%2Fg%2F11c2qnz1v8!19sChIJHbpVpeq4QIYRyGn6l8eeiso?authuser=0&hl=en&rclk=1",Open 24 hours,Not Found,4.8,180,"2607 North Fwy, Houston, TX 77009, United States","""That is super helpful when both people in household work.""","""Pricing was reasonable for AC service."""
Royal Air Houston,https://www.google.com/maps/place/Royal+Air+Houston/data=!4m7!3m6!1s0x8640d12585c3cd25:0xa181bf4550aaeba0!8m2!3d29.8794469!4d-95.598489!16s%2Fg%2F113j7ll2_!19sChIJJc3DhSXRQIYRoOuqUEW_gaE?authuser=0&hl=en&rclk=1,Closed · Opens 8 am Mon,Sunday: Closed||Monday: 8 am–5 pm||Tuesday: 8 am–5 pm||Wednesday: 8 am–5 pm||Thursday: 8 am–5 pm||Friday: 8 am–5 pm||Saturday: Closed,4.6,"8,437","12519 FM 529, Houston, TX 77041, United States","VCH2+QJ Fairview Gardens, Houston, TX, USA","""This company gave me great price and the service is like none other."""
Richmonds Air,https://www.google.com/maps/place/Richmonds+Air/data=!4m7!3m6!1s0x8640dc9a9c9f0471:0x7ddcebbaaa598234!8m2!3d29.8715404!4d-95.4712652!16s%2Fg%2F1tdgkm__!19sChIJcQSfnJrcQIYRNIJZqrrr3H0?authuser=0&hl=en&rclk=1,Closed · Opens 7 am Mon,Sunday: Closed||Monday: 7 am–7 pm||Tuesday: 7 am–7 pm||Wednesday: 7 am–7 pm||Thursday: 7 am–7 pm||Friday: 7 am–7 pm||Saturday: 7 am–5 pm,4.7,370,"Jacob from Richmond's Air was an outstanding HVAC technician. He was thorough, extremely knowledgeable and helpful throughout the entire visit. While diagnosing the issue, he inspected my whole system--not just the problem area--and … More","Richmond’s Air is the real deal. I recently had them install two whole-home dehumidifiers, and I can confidently say they are the local experts when it comes to this kind of work. James, the owner, and Chris, the lead technician, were … More",Richmond’s Air was able to diagnose and fix my AC issue in one visit after the installing company couldn’t after multiple tries. Now they are my go-to for all things HVAC. Jason has been my technician since the beginning and is always very honest and professional. I would recommend this company to anyone.
Be Cool AC & Heating,https://www.google.com/maps/place/Be+Cool+AC+%26+Heating/data=!4m7!3m6!1s0x8640d0e12bd08267:0x154f35d6d0aab7c7!8m2!3d29.890487!4d-95.6401677!16s%2Fg%2F11f3qy630h!19sChIJZ4LQK-HQQIYRx7eq0NY1TxU?authuser=0&hl=en&rclk=1,Closed · Opens 8 am Mon,Sunday: Closed||Monday: 8 am–6 pm||Tuesday: 8 am–6 pm||Wednesday: 8 am–6 pm||Thursday: 8 am–6 pm||Friday: 8 am–6 pm||Saturday: 8 am–2 pm,5,632,"7710 Cherry Park Dr Ste T418, Houston, TX 77095, United States","""I was beyond impressed at the quality of work and service this company provided.""","""Great service techs and great customer service."""
Houston Smart Air Cooling and Heating,https://www.google.com/maps/place/Houston+Smart+Air+Cooling+and+Heating/data=!4m7!3m6!1s0x8640c3336aed68a9:0x4eff89c2ff730f75!8m2!3d29.7227067!4d-95.603476!16s%2Fg%2F1hhjq0gsn!19sChIJqWjtajPDQIYRdQ9z_8KJ_04?authuser=0&hl=en&rclk=1,Closed · Opens 7 am Mon,Sunday: Closed||Monday: 7 am–6 pm||Tuesday: 7 am–6 pm||Wednesday: 7 am–6 pm||Thursday: 7 am–6 pm||Friday: 7 am–6 pm||Saturday: 8 am–12 pm,4.9,166,"12455 Westpark Dr Unit G3, Houston, TX 77082, United States","Extend the Life of Your HVAC Equipment Your HVAC system is one of the biggest investments in your home. Treat it right, and it can last 15+ years. Skip the maintenance? You could be shopping for a new system years sooner than you should. Smart Air's Maintenance Plans are designed to keep your equipment running stronger, longer: ✔ Seasonal tune-ups ✔ Early issue detection ✔ Discounts on repairs (up to 20%) ✔ Discounts on equipment replacement ✔ Priority scheduling Three tiers to fit any budget — Gold, Platinum, and our VIP Comfort Club. See which plan is right for your home: http://houstonsmartair.com/service-plans #HVACTips #HomeMaintenance #HoustonTX #SmartAir","""Highly recommend this company for HVAC service."""
Ace Comfort Air Conditioning & Heating,https://www.google.com/maps/place/Ace+Comfort+Air+Conditioning+%26+Heating/data=!4m7!3m6!1s0x4f92696cded9f175:0xc9ae35805f8c328f!8m2!3d29.8096381!4d-95.3636446!16s%2Fg%2F11tdgh2z3f!19sChIJdfHZ3mxpkk8RjzKMX4A1rsk?authuser=0&hl=en&rclk=1,Closed · Opens 12 am Mon,Not Found,4.9,210,"601 Milwaukee St, Houston, TX 77009, United States","New Carrier AC Replacement | Houston Heights, TX Ace Comfort Air Conditioning & Heating recently completed a new Carrier air conditioner replacement in Houston Heights, Texas. This homeowner was experiencing reduced cooling performance, higher energy bills, and an aging HVAC system. Our team installed a new high-efficiency Carrier air conditioning system designed to improve indoor comfort, energy efficiency, and long-term reliability. This AC installation included proper refrigerant charging, electrical connections, system startup, airflow verification, and performance testing to ensure maximum cooling efficiency during the Houston summer heat. The new system will provide quieter operation, lower utility costs, and improved home comfort year-round. If you're looking for AC replacement in Houston Heights, air conditioning installation near me, HVAC contractor in Houston, Carrier AC installation, air conditioner replacement, heating and cooling services, or energy-efficient HVAC systems, Ace Comfort Air Conditioning & Heating is here to help.","""Booked online at midnight and had a technician here first thing in the morning."""
Houston HVAC,https://www.google.com/maps/place/Houston+HVAC/data=!4m7!3m6!1s0x2594b6871e12ac3d:0xef70c84108303f7e!8m2!3d29.7220723!4d-95.2906253!16s%2Fg%2F11sjh1ph0v!19sChIJPawSHoe2lCURfj8wCEHIcO8?authuser=0&hl=en&rclk=1,Closed · Opens 12 am Mon,Sunday: Closed||Monday: Open 24 hours||Tuesday: Open 24 hours||Wednesday: Open 24 hours||Thursday: Open 24 hours||Friday: Open 24 hours||Saturday: Open 24 hours,4.9,40,"7629 Elm St, Houston, TX 77023, United States","PPC5+RP Lawndale / Wayside, Houston, TX, USA","""Excellent service at an affordable price!"""
H-Town AC Repair HVAC services Houston,https://www.google.com/maps/place/H-Town+AC+Repair+HVAC+services+Houston/data=!4m7!3m6!1s0x8640bf9a7dfcc61d:0xb12f9248118802c4!8m2!3d29.7258364!4d-95.4464075!16s%2Fg%2F11cp78ybns!19sChIJHcb8fZq_QIYRxAKIEUiSL7E?authuser=0&hl=en&rclk=1,Closed · Opens 7 am Mon,Sunday: Closed||Monday: 7 am–7 pm||Tuesday: 7 am–7 pm||Wednesday: 7 am–7 pm||Thursday: 7 am–7 pm||Friday: 7 am–7 pm||Saturday: 7 am–4 pm,4.8,276,"4243 Purdue St A, Houston, TX 77005, United States","PHG3+8C Greenway / Upper Kirby Area, Houston, TX, USA","""They offered a 10 year service warranty and good quality Carrier equipment."""
Dave Lane's Hi-Tech Mechanical Inc.,https://www.google.com/maps/place/Dave+Lane%27s+Hi-Tech+Mechanical+Inc./data=!4m7!3m6!1s0x8640cf5e823eb8b1:0xad12932e49313438!8m2!3d30.0278302!4d-95.5866083!16s%2Fg%2F1tdw8fsb!19sChIJsbg-gl7PQIYRODQxSS6TEq0?authuser=0&hl=en&rclk=1,Closed · Opens 9 am,Sunday: 9 am–5 pm||Monday: 8 am–7 pm||Tuesday: 8 am–7 pm||Wednesday: 8 am–7 pm||Thursday: 8 am–7 pm||Friday: 8 am–7 pm||Saturday: 9 am–5 pm,4.9,"1,016","17857 Hufsmith - Kohrville Rd, Tomball, TX 77375, United States","""AC Diagnostic was well priced and service was quick and hassle free.""","""My co-worker told me this is a small family owned company that does great work."""
"Abacus Plumbing, Air Conditioning, & Electrical","https://www.google.com/maps/place/Abacus+Plumbing,+Air+Conditioning,+%26+Electrical/data=!4m7!3m6!1s0x8640c5d54b35a963:0xde884c48d45e5c38!8m2!3d29.9421473!4d-95.3293103!16s%2Fg%2F1v_vt8w3!19sChIJY6k1S9XFQIYROFxe1EhMiN4?authuser=0&hl=en&rclk=1",Open 24 hours,Sunday: Open 24 hours||Monday: Open 24 hours||Tuesday: Open 24 hours||Wednesday: Open 24 hours||Thursday: Open 24 hours||Friday: Open 24 hours||Saturday: Open 24 hours,4.7,"11,802","Abacus Plumbing, Air Conditioning, & Electrical","4001 Kendrick Plaza Dr, Houston, TX 77032, United States","Award-Winning Service Since 2003 Recognized by BBB, Angie's List, and Home Advisor! Consistent quality, honest service, and customer satisfaction drive everything we do in Houston. #TrustedService"
Ethan Clark Air Conditioning,https://www.google.com/maps/place/Ethan+Clark+Air+Conditioning/data=!4m7!3m6!1s0x8640bf2a3bf00cef:0xd8c1edd1a2eb234!8m2!3d29.7686692!4d-95.3536644!16s%2Fg%2F1v9t_8pg!19sChIJ7wzwOyq_QIYRNLIuGt0ejA0?authuser=0&hl=en&rclk=1,Closed · Opens 8 am Mon,Sunday: Closed||Monday: 8 am–5 pm||Tuesday: 8 am–5 pm||Wednesday: 8 am–5 pm||Thursday: 8 am–5 am||Friday: 8 am–5 pm||Saturday: Closed,5,174,"1320 Rothwell St, Houston, TX 77002, United States","QJ9W+FG Downtown Houston, Houston, TX, USA","""Year after year, consistent quality of service and responsiveness."""
"Heights A/C & Heating, LLC.","https://www.google.com/maps/place/Heights+A%2FC+%26+Heating,+LLC./data=!4m7!3m6!1s0x8640c77cbef22343:0x549a650b025e554e!8m2!3d29.8339515!4d-95.4346126!16s%2Fg%2F11cs4gk9zn!19sChIJQyPyvnzHQIYRTlVeAgtlmlQ?authuser=0&hl=en&rclk=1",Closed · Opens 8 am Mon,Sunday: Closed||Monday: 8 am–5 pm||Tuesday: 8 am–5 pm||Wednesday: 8 am–5 pm||Thursday: 8 am–5 pm||Friday: 8 am–5 pm||Saturday: Closed,4.9,68,"Hands down the best AC and heating biz anywhere! Thomas and Sara are like having great friends you know have an AC company. Trustworthy, honest impeccable work! They will explain everything show up on time and do amazing work, they did even more for my new system they installed then they needed too! I won’t use anybody else! Love them.",My AC had been making a very annoying noise. Village AC came out and gave me a quote of $3500 to replace the blower motor. We got a second opinion from Heights and the tech Mitch immediately knew the noise was just a loose piece of metal … More,"I needed to replace 2 air conditioning units, 2 furnaces, and  ductwork. Given the scale & cost involved, I did my due diligence getting 4 quotes. The other 3 companies sent a salesperson, only Heights AC sent a Technician. Mitch's … More"
Baker-Jones Co. Inc,https://www.google.com/maps/place/Baker-Jones+Co.+Inc/data=!4m7!3m6!1s0x8640bf7112955d49:0x830db26f493f4f25!8m2!3d29.6973266!4d-95.3569617!16s%2Fg%2F1v8y4dml!19sChIJSV2VEnG_QIYRJU8_SW-yDYM?authuser=0&hl=en&rclk=1,Closed · Opens 8 am Mon,Sunday: Closed||Monday: 8 am–5 pm||Tuesday: 8 am–5 pm||Wednesday: 8 am–5 pm||Thursday: 8 am–5 pm||Friday: 8 am–5 pm||Saturday: Closed,5,232,"6314 St Augustine St, Houston, TX 77021, United States","""This company has been serving me for over 20 years from sales to service.""","""Grad customer service, speedy response, very reasonable price."""
Excel Air,https://www.google.com/maps/place/Excel+Air/data=!4m7!3m6!1s0x8640d1fec4b7eec3:0xd19bdf9d0a020a14!8m2!3d29.8565291!4d-95.5654608!16s%2Fg%2F11fn22mrz4!19sChIJw-63xP7RQIYRFAoCCp3fm9E?authuser=0&hl=en&rclk=1,Open 24 hours,Sunday: Open 24 hours||Monday: Open 24 hours||Tuesday: Open 24 hours||Wednesday: Open 24 hours||Thursday: Open 24 hours||Friday: Open 24 hours||Saturday: Open 24 hours,4.9,483,"6125 W Sam Houston Pkwy N Ste 301, Houston, TX 77041, United States","""Ishmael is knowledgeable on service issues and personable to work with.""","""If your a senior discount was better two Great place to do business"
68 Degrees HVAC,https://www.google.com/maps/place/68+Degrees+HVAC/data=!4m7!3m6!1s0x8640d32842c0a06f:0xf01a45b02e542e26!8m2!3d29.836095!4d-95.46119!16s%2Fg%2F11jdxygmgj!19sChIJb6DAQijTQIYRJi5ULrBFGvA?authuser=0&hl=en&rclk=1,Closed · Opens 8 am Mon,Sunday: Closed||Monday: 8 am–5 pm||Tuesday: 8 am–5 pm||Wednesday: 8 am–5 pm||Thursday: 8 am–5 pm||Friday: 8 am–5 pm||Saturday: Closed,5,260,"Best HVAC service I’ve ever had.  Steve was very technically knowledgeable, the installation was done extremely well and they were clean and cautious.  Actually have air in my office for the first time in this house!  The master bedroom … More","68 Degrees is the only HVAC company I will ever call. Every technician they’ve sent has been knowledgeable, friendly, and honest. They provide excellent service, explain everything clearly, and never try to sell you something you don’t need. I highly recommend them.","We had a great experience with 68 Degrees and highly recommend them. They were prompt, professional, honest, and friendly from start to finish. It’s hard to find companies you can truly trust, but they took the time to explain everything, … More"
"Peter's Plumbing & Remodeling, LLC","https://www.google.com/maps/place/Peter%27s+Plumbing+%26+Remodeling,+LLC/data=!4m7!3m6!1s0x8640d7e511f8f3c3:0x114cccbecdcc2b05!8m2!3d29.902044!4d-95.66448!16s%2Fg%2F11h1vbldnw!19sChIJw_P4EeXXQIYRBSvMzb7MTBE?authuser=0&hl=en&rclk=1",Closed · Opens 8 am Mon,Sunday: Closed||Monday: 8 am–5 pm||Tuesday: 8 am–5 pm||Wednesday: 8 am–5 pm||Thursday: 8 am–5 pm||Friday: 8 am–5 pm||Saturday: 8 am–5 pm,4.9,128,"16519 Innisbrook Dr, Houston, TX 77095, United States","""Was able to offer same day service and his pricing beat out the competition.""","""He installed our sink faucet and toilet Clean work and affordable price"
Mitchells Mechanical,https://www.google.com/maps/place/Mitchells+Mechanical/data=!4m7!3m6!1s0x86473424aa9ff82b:0xc32bbe40ada4948c!8m2!3d30.055431!4d-95.354928!16s%2Fg%2F119vtmld5!19sChIJK_ifqiQ0R4YRjJSkrUC-K8M?authuser=0&hl=en&rclk=1,Closed · Opens 9 am,Sunday: 9 am–5 pm||Monday: 9 am–8 pm||Tuesday: 9 am–12:30 am||Wednesday: 9 am–8 pm||Thursday: 9 am–8 pm||Friday: 9 am–8 pm||Saturday: 9 am–5 pm,4.7,56,Mitchell's Mechanical - Heating & Cooling Solutions,Experience reliable heating and cooling. Our licensed technicians are ready to help.,"23801 Cypresswood Dr Ste 107, Spring, TX 77373, United States"
24 Seven AC,https://www.google.com/maps/place/24+Seven+AC/data=!4m7!3m6!1s0xaa87679721340715:0x746334127b854644!8m2!3d29.7383403!4d-95.605409!16s%2Fg%2F11sdp1vxqn!19sChIJFQc0IZdnh6oRREaFexI0Y3Q?authuser=0&hl=en&rclk=1,Closed · Opens 10 am Mon,Sunday: Closed||Monday: 10 am–8 pm||Tuesday: 10 am–8 pm||Wednesday: 10 am–8 pm||Thursday: 10 am–8 pm||Friday: 10 am–8 pm||Saturday: Closed,4.9,406,"2415 S Dairy Ashford Rd Ste C005, Houston, TX 77077, United States","24/7 HVAC Emergency Repair – Fast AC Help When You Need It Most Facing an HVAC emergency repair in Houston right now? 24 Seven AC provides rapid, reliable cooling relief when you need it most. Our expert techs restore your comfort with transparent pricing. Don’t sweat the heat—call the pros today!","""Amazing service and honest people with competitive prices"""
75 Degree AC- Houston,https://www.google.com/maps/place/75+Degree+AC-+Houston/data=!4m7!3m6!1s0x8640c668d5afffff:0xd5c7e9b53695698c!8m2!3d29.8199977!4d-95.4604187!16s%2Fg%2F11sh5x8lcj!19sChIJ__-v1WjGQIYRjGmVNrXpx9U?authuser=0&hl=en&rclk=1,Closed · Opens 8 am,Not Found,5,239,"4800 W 34th St C50F, Houston, TX 77092, United States","RG9Q+XR Central Northwest, Houston, TX, USA","Houston forecast: 97 by Saturday, heat index near 106°F. If your AC hasn't been serviced since last summer, this is your last realistic window. Once it crosses 95 here, calls spike citywide, and every company goes from same-week to a 5 to 7 day backlog. What we're finding this week: clogged drain lines, coils packed with spring pollen, weak capacitors, and slow refrigerant leaks. These are $200 to $400 fixes now. They become $1,200 to $2,500 emergencies in July. $89 tune-up, same-week slots still open across Houston."
Comfort Star Ac Repair,https://www.google.com/maps/place/Comfort+Star+Ac+Repair/data=!4m7!3m6!1s0x8640c3d6885d70df:0xf1545701d2e739a3!8m2!3d29.7984519!4d-95.5211746!16s%2Fg%2F126228ggm!19sChIJ33BdiNbDQIYRoznn0gFXVPE?authuser=0&hl=en&rclk=1,Closed · Opens 8 am Mon,Sunday: Closed||Monday: 8 am–8 pm||Tuesday: 8 am–8 pm||Wednesday: 8 am–8 pm||Thursday: 8 am–8 pm||Friday: 8 am–8 pm||Saturday: 8 am–5 pm,4.9,408,"9319 Long Point Rd, Houston, TX 77055, United States","QFXH+9G Spring Branch Central, Houston, TX, USA",Contact us for a free consultation Make an appointment today for an Estimate! #acrepair #acrepairhouston #comfortstaracrepair
P & M Air Conditioning and Heating,https://www.google.com/maps/place/P+%26+M+Air+Conditioning+and+Heating/data=!4m7!3m6!1s0x8640bdffa836c8e9:0xec0635321b31cc57!8m2!3d29.685208!4d-95.3077!16s%2Fg%2F1tjdrqc7!19sChIJ6cg2qP-9QIYRV8wxGzI1Buw?authuser=0&hl=en&rclk=1,Closed · Opens 8 am Mon,Sunday: Closed||Monday: 8 am–5 pm||Tuesday: 8 am–5 pm||Wednesday: 8 am–5 pm||Thursday: 8 am–5 pm||Friday: 8 am–5 pm||Saturday: Closed,4.7,232,"6734 Rupley Cir, Houston, TX 77087, United States","MMPR+3W Southeast Houston, Houston, TX, USA","""Great Job"" - Patti LeClear. Enjoying a cool and comfortable home in Houston is crucial as temperatures rise. Regular HVAC maintenance helps prevent breakdowns during the heat. 💧 Before summer hits, check your air filters and clean your outdoor unit to enhance efficiency. Scheduled servicing ensures your system operates its best! For expert HVAC service in Houston and the surrounding areas, reach out today! ☀️ #HVACNearMe #ACRepairNearMe #HoustonAirConditioning #SummerReady"
"Bayou City Aire, LLC","https://www.google.com/maps/place/Bayou+City+Aire,+LLC/data=!4m7!3m6!1s0x8640b8eba3caf80b:0x66c0161a66f9841!8m2!3d29.8147425!4d-95.3838166!16s%2Fg%2F1thp8cb7!19sChIJC_jKo-u4QIYRQZhvpmEBbAY?authuser=0&hl=en&rclk=1",Closed · Opens 8 am Mon,Sunday: Closed||Monday: 8 am–5 pm||Tuesday: 8 am–5 pm||Wednesday: 8 am–5 pm||Thursday: 8 am–5 pm||Friday: 8 am–5 pm||Saturday: Closed,4.9,74,"1205 North Loop, Houston, TX 77022, United States","""Excellent service, great communication and transparent pricing.""","""The restored sound of the blower fan was music to my ears."""
