business_name,gbp_url,business_hours,weekly_hours,rating,review_count,top_review_1,top_review_2,top_review_3
Texas Strong Mechanical,https://www.google.com/maps/place/Texas+Strong+Mechanical/data=!4m7!3m6!1s0x8640aff1b0996d45:0x4a55a0604b8d6255!8m2!3d29.9977625!4d-95.2649748!16s%2Fg%2F11h55nwr3y!19sChIJRW2ZsPGvQIYRVWKNS2CgVUo?authuser=0&hl=en&rclk=1,Open 24 hours,Sunday: Open 24 hours||Monday: Open 24 hours||Tuesday: Open 24 hours||Wednesday: Open 24 hours||Thursday: Open 24 hours||Friday: Open 24 hours||Saturday: Open 24 hours,4.9,273,"120 E Main St, Humble, TX 77338, United States","Is your air conditioner ready to survive another brutal Houston summer, or is it a breakdown waiting to happen? Stay ahead of the game with Texas Strong Mechanical!","""Great work at a reasonable price with well groomed & trained professionals."""
Air-Ton Heating and AC,https://www.google.com/maps/place/Air-Ton+Heating+and+AC/data=!4m7!3m6!1s0x8640eb04c0a3110b:0xdc33486b2f6419b7!8m2!3d29.6606427!4d-95.4444795!16s%2Fg%2F11c31q2mqq!19sChIJCxGjwATrQIYRtxlkL2tIM9w?authuser=0&hl=en&rclk=1,Closed · Opens 7:30 am Mon,Sunday: Closed||Monday: 7:30 am–8 pm||Tuesday: 7:30 am–8 pm||Wednesday: 7:30 am–8 pm||Thursday: 7:30 am–8 pm||Friday: 7:30 am–8 pm||Saturday: 9 am–3 pm,5,195,"4102 Dawn, Houston, TX 77025, United States","MH64+76 Willow Meadows/ Willowbend Area, Houston, TX, USA",𝐇𝐨𝐰 𝐂𝐚𝐧 𝐈 𝐀𝐟𝐟𝐨𝐫𝐝 𝐚 𝐍𝐞𝐰 𝐀𝐂 𝐒𝐲𝐬𝐭𝐞𝐦 (𝐚𝐧𝐝 𝐎𝐭𝐡𝐞𝐫 𝐇𝐕𝐀𝐂 𝐄𝐪𝐮𝐢𝐩𝐦𝐞𝐧𝐭)? Need a new AC or HVAC system in West University Place but unsure how to afford it? Air-Ton Heating & AC's newest blog covers cost-saving strategies and options to make your upgrade easier. Learn more today!
Spring Branch AC,https://www.google.com/maps/place/Spring+Branch+AC/data=!4m7!3m6!1s0x8640cfacbec83fdb:0x201345c3d2a143c4!8m2!3d29.8662889!4d-95.5208938!16s%2Fg%2F1tfqg5km!19sChIJ2z_IvqzPQIYRxEOh0sNFEyA?authuser=0&hl=en&rclk=1,Closed · Opens 12 am Mon,Sunday: Closed||Monday: Open 24 hours||Tuesday: Open 24 hours||Wednesday: Open 24 hours||Thursday: Open 24 hours||Friday: Open 24 hours||Saturday: Open 24 hours,4.9,409,"6817 Flintlock Rd E, Houston, TX 77040, United States","VF8H+GJ Northwest Houston, Houston, TX, USA",Before Summer Inspections! Full Year of Maintenance for $149!
Nick's Plumbing & Air Conditioning,https://www.google.com/maps/place/Nick%27s+Plumbing+%26+Air+Conditioning/data=!4m7!3m6!1s0x8640c76a4c3f8f73:0x7ae991add0786989!8m2!3d29.8200218!4d-95.3989549!16s%2Fg%2F1tf719p9!19sChIJc48_TGrHQIYRiWl40K2R6Xo?authuser=0&hl=en&rclk=1,Closed · Opens 8 am Mon,Sunday: Closed||Monday: 8 am–6 pm||Tuesday: 8 am–6 pm||Wednesday: 8 am–6 pm||Thursday: 8 am–6 pm||Friday: 8 am–6 pm||Saturday: 8 am–5 pm,4.7,"4,193","3780 Yale St, Houston, TX 77018, United States","""I was impressed with the quality of the work, the friendly staff and the price.""","""Professional performance from all,; answering service, office, and technician."""
Uptown Heating & Air Conditioning,https://www.google.com/maps/place/Uptown+Heating+%26+Air+Conditioning/data=!4m7!3m6!1s0x8640daaa48c80277:0x58e1c3d77bdd2965!8m2!3d29.7265181!4d-95.5739939!16s%2Fg%2F11g8vcj293!19sChIJdwLISKraQIYRZSnde9fD4Vg?authuser=0&hl=en&rclk=1,Closed · Opens 5 am Mon,Not Found,4.9,"2,704","11211 Richmond Ave Ste B102, Houston, TX 77082, United States","SPRING, TX: DON’T LET A SMALL A/C PROBLEM GET WORSE In Spring, TX, your A/C needs to be ready for the heat. If your system is not cooling properly, making noises, leaking water, or running longer than usual, it may be time for a repair. Fixing your A/C early can help: ✔ Prevent costly breakdowns ✔ Keep your home cool and comfortable ✔ Improve airflow and cooling performance ✔ Reduce stress on the compressor ✔ Help lower energy use ✔ Extend the life of your system Ignoring small A/C issues can lead to bigger repairs and leave you without cooling when you need it most. Stay cool in Spring, TX — repair your A/C before the problem becomes bigger. Uptown Heating and Air Conditioning ❄️ #SpringTX #ACRepair #HVACService #AirConditioning #SpringHVAC #HVACRepair #TexasHeat #HomeComfort #CoolingSystem #StayCool #ACService #PreventBreakdowns #UptownHeatingAndAirConditioning","""Great customer service excellent communicate skills love work with thw company"""
Courtesy Air Conditioning & Heating,https://www.google.com/maps/place/Courtesy+Air+Conditioning+%26+Heating/data=!4m7!3m6!1s0x8640c3bf0ad1018f:0x188be72bbd06ef2b!8m2!3d29.7494311!4d-95.6263833!16s%2Fg%2F1tdy087b!19sChIJjwHRCr_DQIYRK-8GvSvnixg?authuser=0&hl=en&rclk=1,Closed · Opens 10 am,Sunday: 10 am–5 pm||Monday: 8 am–10 pm||Tuesday: 8 am–10 pm||Wednesday: 8 am–10 pm||Thursday: 8 am–10 pm||Friday: 8 am–10 pm||Saturday: 9 am–9 pm,5,213,"1950 Eldridge Pkwy, Houston, TX 77077, United States","P9XF+QC Energy Corridor, Houston, TX, USA","""Excellent air conditioning company there service was exc. from start to finish."""
Sugar Land AC and Heating,https://www.google.com/maps/place/Sugar+Land+AC+and+Heating/data=!4m7!3m6!1s0x8640e9601998d299:0xcdf02addbadd70ea!8m2!3d29.6939815!4d-95.6124371!16s%2Fg%2F11g2zglq5d!19sChIJmdKYGWDpQIYR6nDdut0q8M0?authuser=0&hl=en&rclk=1,Closed · Opens 8 am Mon,Sunday: Closed||Monday: 8 am–5 pm||Tuesday: 8 am–5 pm||Wednesday: 8 am–5 pm||Thursday: 8 am–5 pm||Friday: 8 am–5 pm||Saturday: 8 am–12 pm,5,153,"7615 Summer Glen Ln, Houston, TX 77072, United States","""Great work, Awesome service and prices.""","""Great professional services from management to the repairmen staff."""
Houk Air Conditioning Houston,https://www.google.com/maps/place/Houk+Air+Conditioning+Houston/data=!4m7!3m6!1s0x8640be0e41536659:0xbc81c52283af6d94!8m2!3d29.9902497!4d-95.3741508!16s%2Fg%2F11b77qrmpn!19sChIJWWZTQQ6-QIYRlG2vgyLFgbw?authuser=0&hl=en&rclk=1,Closed · Opens 8 am Mon,Sunday: Closed||Monday: 8 am–5 pm||Tuesday: 8 am–5 pm||Wednesday: 8 am–5 pm||Thursday: 8 am–5 pm||Friday: 8 am–5 pm||Saturday: Closed,4.6,865,"18720 Intercontinental Crossing Dr, Houston, TX 77032, United States","🌬️ Improve Airflow and Cooling Performance 🌬️ Poor airflow can reduce comfort and force your AC system to work harder. Cleaning filters, inspecting ducts, and servicing your HVAC system can improve airflow and help maintain consistent cooling. #HoustonHVAC #HoustonACRepair #AirConditioningHouston #HoustonCooling #HVACRepairNearMe #TexasHeat #HoukAirConditioning","""Prompt service, very knowledgeable and respectful of the customer's home."""
The Katy Plumbing Company Heating & Air,https://www.google.com/maps/place/The+Katy+Plumbing+Company+Heating+%26+Air/data=!4m7!3m6!1s0x8641277ff9704839:0x23f29f816f8e64d2!8m2!3d29.796604!4d-95.823997!16s%2Fg%2F1hc6jgz16!19sChIJOUhw-X8nQYYR0mSOb4Gf8iM?authuser=0&hl=en&rclk=1,Open 24 hours,Sunday: Open 24 hours||Monday: Open 24 hours||Tuesday: Open 24 hours||Wednesday: Open 24 hours||Thursday: Open 24 hours||Friday: Open 24 hours||Saturday: Open 24 hours,4.9,"3,637","1704 Avenue D, Katy, TX 77493, United States","🚨 Now Hiring: Part-Time Evening Dispatcher (Work From Home!) 🚨 Katy Plumbing Company Heating & Air is looking for a reliable, experienced Evening Dispatcher to join our team! 🕓 Schedule: • Monday, Tuesday & Wednesday • 4:00 PM – 7:00 AM (overnight availability required) 🏠 Work From Home Position ✅ Requirements: • Prior dispatch experience • Strong customer service skills • Computer proficiency • Reliable internet connection • Availability for one week of daytime training If you’re organized, dependable, and experienced in dispatching, we’d love to hear from you! 📧 Apply or inquire: Send your resume or questions to mandy@katyplumbers.com 👉 Feel free to share with anyone who might be a great fit!","""Ryan was great… answered all my questions.. gave me a price before service."""
Space City Mechanical,https://www.google.com/maps/place/Space+City+Mechanical/data=!4m7!3m6!1s0x8640ea5b2d02a195:0xc8c594293530252e!8m2!3d29.6462653!4d-95.4463011!16s%2Fg%2F11c1sk1fjh!19sChIJlaECLVvqQIYRLiUwNSmUxcg?authuser=0&hl=en&rclk=1,Closed · Opens 8 am,Sunday: 8 am–5 pm||Monday: Open 24 hours||Tuesday: Open 24 hours||Wednesday: Open 24 hours||Thursday: Open 24 hours||Friday: Open 24 hours||Saturday: Open 24 hours,4.9,69,"12585 Hiram Clarke Rd, Houston, TX 77045, United States","JHW3+GF Central Southwest, Houston, TX, USA","""I truly appreciate their quality work and friendly service."""
"Air Current AC & Heat, LLC","https://www.google.com/maps/place/Air+Current+AC+%26+Heat,+LLC/data=!4m7!3m6!1s0x8640c343dc630233:0x95a50b4d59336fe9!8m2!3d29.6835398!4d-95.5125013!16s%2Fg%2F11hdj4xvpz!19sChIJMwJj3EPDQIYR6W8zWU0LpZU?authuser=0&hl=en&rclk=1",Closed · Opens 10 am,Sunday: 10 am–4 pm||Monday: 8 am–6 pm||Tuesday: 8 am–6 pm||Wednesday: 8 am–6 pm||Thursday: 8 am–6 pm||Friday: 8 am–6 pm||Saturday: 10 am–4 pm,5,182,"8703 Bonhomme Rd, Houston, TX 77074, United States","Thermostat Settings for Energy Savings This Summer Looking to stay cool without driving up energy bills? During the summer, setting your thermostat to 78 degrees when you are home is a great balance between comfort and efficiency. When you are away, consider raising the temperature a few degrees to reduce unnecessary cooling. Using a programmable or smart thermostat makes these adjustments easy and automatic. Small changes in your settings can lead to noticeable savings over the course of the season. Have questions about optimizing your system for summer? Give us a call!","""I could not be happier with him and the quality of service I received today!"""
M E Brown Air Conditioning Company LLC,https://www.google.com/maps/place/M+E+Brown+Air+Conditioning+Company+LLC/data=!4m7!3m6!1s0x8640cf5e81bfcd1d:0x3a4c80c5ca9a8276!8m2!3d29.9013485!4d-95.5390558!16s%2Fg%2F1tzgk07t!19sChIJHc2_gV7PQIYRdoKaysWATDo?authuser=0&hl=en&rclk=1,Closed · Opens 5 am Mon,Sunday: Closed||Monday: 5 am–7 pm||Tuesday: 5 am–7 pm||Wednesday: 5 am–7 pm||Thursday: 5 am–7 pm||Friday: 5 am–7 pm||Saturday: 5 am–2 pm,4.9,304,"Windfern Rd, Houston, TX 77064, United States","""They are great people providing excellent service at a far price.""","""Their pricing was fair, and the quality of work was excellent."""
Valderrama A/C & Refrigeration,https://www.google.com/maps/place/Valderrama+A%2FC+%26+Refrigeration/data=!4m7!3m6!1s0x864097fea463aa33:0x8958851be35381b9!8m2!3d29.6557924!4d-95.2433499!16s%2Fg%2F11nymhng7_!19sChIJM6pjpP6XQIYRuYFT4xuFWIk?authuser=0&hl=en&rclk=1,Closed · Opens 8 am,Sunday: 8 am–5 pm||Monday: 7 am–11 pm||Tuesday: 7 am–11 pm||Wednesday: 7 am–11 pm||Thursday: 7 am–11 pm||Friday: 7 am–11 pm||Saturday: 7 am–11 pm,4.8,309,"1212 Illinois St, South Houston, TX 77587, United States","""They offered great pricing without sacrificing quality or service.""","""Best services fast response and great prices I definitely recommend them"""
Texas Pride Air Conditioning & Heating,https://www.google.com/maps/place/Texas+Pride+Air+Conditioning+%26+Heating/data=!4m7!3m6!1s0x8640c723cb4faa15:0x956383ad0aa89629!8m2!3d29.8339515!4d-95.4346126!16s%2Fg%2F1263hlzfl!19sChIJFapPyyPHQIYRKZaoCq2DY5U?authuser=0&hl=en&rclk=1,Closed · Opens 8 am Mon,Sunday: Closed||Monday: 8 am–6 pm||Tuesday: 8 am–6 pm||Wednesday: 8 am–6 pm||Thursday: 8 am–6 pm||Friday: 8 am–6 pm||Saturday: 8 am–6 pm,4.9,405,"Cold Climate Heat Pumps Are HVAC Game Changers If you are looking for an HVAC system that heats and cools your Houston home, lowers energy bills, and is easy on the environment and your budget, consider an air-source heat pump. If you are worried about lackluster heat pump performance and efficiency in freezing winter temperatures, get a cold climate heat pump. Cold climate heat pumps are an excellent solution for homeowners who want superior heating performance in low temperatures, like geothermal, but with lower upfront costs.",Great price for the install of my new AC. They were on time and they finished the job quickly. They also cleaned up afterwards. … More,"Services over and above, they came after hours,  the owner took my call and personally performed the needed service. I have been a customer for over 20 years they have replaced 3 complete systems and have reliable and efficient service … More"
Service Experts Houston,https://www.google.com/maps/place/Service+Experts+Houston/data=!4m7!3m6!1s0x8640db314c21c923:0x1e931a697f8c9024!8m2!3d29.9384103!4d-95.324217!16s%2Fg%2F1tdvdzdl!19sChIJI8khTDHbQIYRJJCMf2kakx4?authuser=0&hl=en&rclk=1,Open 24 hours,Sunday: Open 24 hours||Monday: Open 24 hours||Tuesday: Open 24 hours||Wednesday: Open 24 hours||Thursday: Open 24 hours||Friday: Open 24 hours||Saturday: Open 24 hours,4.8,"4,478","4250 N Sam Houston Pkwy E Ste 130, Houston, TX 77032, United States","When summer temperatures rise, your HVAC and plumbing systems work overtime. Small, hidden issues can quickly turn into expensive emergencies during peak heatwaves. For all your HVAC and plumbing needs, leave it to the Experts and enjoy a worry-free summer Check out our Summer Specials today and save.","Wendell Steen from Church Services did an excellent job repairing our A/C! He was on time, efficient, successful and very professional and respectful. Wendell was very clear in explaining the problem and options for preventing the problem from happening again. I would definitely recommend Wendell as a competent A/C repairman"
Air Rey - Houston,https://www.google.com/maps/place/Air+Rey+-+Houston/data=!4m7!3m6!1s0x8640dda1de759317:0x1453b6d9e16f3ac5!8m2!3d29.863974!4d-95.582323!16s%2Fg%2F11g0k1ytm5!19sChIJF5N13qHdQIYRxTpv4dm2UxQ?authuser=0&hl=en&rclk=1,Closed · Opens 8 am,Sunday: 8 am–9 pm||Monday: 8 am–9 pm||Tuesday: 8 am–9 pm||Wednesday: 8 am–9 pm||Thursday: 8 am–9 pm||Friday: 8 am–9 pm||Saturday: 8 am–9 pm,4.6,974,"6529 Cunningham Rd #2001, Houston, TX 77041, United States",Es la peor decision que hice al ver buscado esta compania me cambian todo el systema todo nuevo y a los nueves 9 se conjela y luego q llegan y dis q lo reparan y otra ves a los 10 despues igual y mandan alguin q lo revicen el mantes y te dicen todo esta trabajando bien no pasa 2 dia s y esta el air con el mismo prolemasolo hay q hacerle una reparation pero la repa Asta el 04/29/2025 esta compania es lmalicima en servio empesando con service al cliente le pedi hablar con un manager y medijero es q no tiene manager x atenderme,"""His workmanship and customer care truly reflect a high standard of service."""
ARS / Rescue Rooter,https://www.google.com/maps/place/ARS+%2F+Rescue+Rooter/data=!4m7!3m6!1s0x8640cfff344ab659:0x5e9a0b32e42faca0!8m2!3d29.8583368!4d-95.5565833!16s%2Fg%2F1tfkwpxr!19sChIJWbZKNP_PQIYRoKwv5DILml4?authuser=0&hl=en&rclk=1,Open 24 hours,Not Found,4.6,"12,248","10515 Okanella St Ste 100, Houston, TX 77041, United States","VC5V+89 Northwest Houston, Houston, TX, USA","The start of summer can bring heavy storms and sudden plumbing emergencies. High winds and a lot of rain can put a strain on your home's drainage and sewer systems. Our professionals are available to handle urgent issues like burst pipes or major backups. Our technicians arrive quickly with the tools needed to stop water damage and restore your home to safety. We understand that a plumbing emergency is a stressful event, and we work hard to provide a calm and professional solution. Our team is trained to handle high-pressure situations with skill and care. Being prepared for a plumbing emergency is the best way to protect your property. Our professionals can show you how to shut off your water and electricity in an emergency. If a storm causes a pipe to break, our technicians can perform a professional repair immediately. We use high-quality materials to ensure the fix is permanent. Our professionals also check for any damage to your main lines after a big storm. We provide a thorough inspection to make sure your home is secure for the rest of the summer. Our team is dedicated to providing reliable and professional service when you need it most. Do not hesitate to call our technicians if you experience a sudden plumbing problem. We are here to provide the expert help your home requires. Trust our professionals to keep your plumbing system safe all summer long."
Aire Serv of Central & West Houston,https://www.google.com/maps/place/Aire+Serv+of+Central+%26+West+Houston/data=!4m7!3m6!1s0x8640dbed7581de8d:0xb774839480685550!8m2!3d29.736916!4d-95.4419929!16s%2Fg%2F11fgm1vcdn!19sChIJjd6Bde3bQIYRUFVogJSDdLc?authuser=0&hl=en&rclk=1,Open 24 hours,Sunday: Open 24 hours||Monday: Open 24 hours||Tuesday: Open 24 hours||Wednesday: Open 24 hours||Thursday: Open 24 hours||Friday: Open 24 hours||Saturday: Open 24 hours,4.9,200,"3100 Weslayan St Ste 232, Houston, TX 77027, United States","PHP5+Q6 Greenway / Upper Kirby Area, Houston, TX, USA","An AC that cools but leaves the house sticky means it is cycling too fast to remove humidity. Aire Serv of Central & West Houston diagnoses the real cause and recommends the right solution. Sometimes a whole-home dehumidifier is the fix, not a bigger unit. Honest assessment. No upselling. Upfront pricing. Call Aire Serv of Central & West Houston and actually feel comfortable this summer. #IndoorHumidity #ACRepair #SummerComfort #Houston #AireServ #HomeHumidity #HVACService #NeighborlyDoneRight"
Just-N-Time AC and Heating,https://www.google.com/maps/place/Just-N-Time+AC+and+Heating/data=!4m7!3m6!1s0x8640c76264b44ec1:0x4642eb17dbc7e102!8m2!3d29.8170222!4d-95.4409589!16s%2Fg%2F11j8hlhht8!19sChIJwU60ZGLHQIYRAuHH2xfrQkY?authuser=0&hl=en&rclk=1,Closed · Opens 7 am Mon,Sunday: Closed||Monday: 7 am–9 pm||Tuesday: 7 am–9 pm||Wednesday: 7 am–9 pm||Thursday: 7 am–9 pm||Friday: 7 am–9 pm||Saturday: 7 am–7 pm,4.9,405,"2219 W 34th St # A1, Houston, TX 77018, United States","RH85+RJ Central Northwest, Houston, TX, USA","Is your HVAC system ready for seasonal changes? Regular maintenance by professionals—including checkups, repairs, and clean ductwork—ensures efficient performance and year-round comfort. Don’t wait for a breakdown; schedule a checkup today to keep your Houston home or business comfortable."
EZ Comfort Air Conditioning & Heating,https://www.google.com/maps/place/EZ+Comfort+Air+Conditioning+%26+Heating/data=!4m7!3m6!1s0x8640b1748f596353:0xc00bedc96c23f93b!8m2!3d29.9511426!4d-95.2730557!16s%2Fg%2F11c6dtrqbz!19sChIJU2NZj3SxQIYRO_kjbMntC8A?authuser=0&hl=en&rclk=1,Closed · Opens 8 am Mon,Sunday: Closed||Monday: 8 am–9 pm||Tuesday: 8 am–9 pm||Wednesday: 8 am–9 pm||Thursday: 8 am–9 pm||Friday: 8 am–9 pm||Saturday: 8 am–5 pm,4.9,"1,063","7575 Charpiot Ln, Humble, TX 77396, United States","🏡 NEW HOMEOWNER? Don’t Forget About Your HVAC System! ❄️☀️ Today we visited a new homeowner who had no idea there was a media filter hidden in the attic. When we checked it, this is what we found… 😳 Many homeowners focus on paint, landscaping, and upgrades after moving in, but often overlook one of the most important systems in the home—your air conditioning and heating system. A neglected filter can: ✅ Reduce airflow ✅ Increase energy bills ✅ Cause poor indoor air quality ✅ Put unnecessary strain on your equipment ✅ Lead to costly repairs and shortened system life At EZ Comfort Air Conditioning & Heating LLC, we recommend every new homeowner schedule a professional HVAC inspection and maintenance visit to: ✔ Check filters and air quality components ✔ Inspect refrigerant levels and electrical components ✔ Verify proper airflow and system performance ✔ Identify issues before they become expensive repairs ✔ Keep your home comfortable year-round Don’t wait until the hottest day of summer or the coldest day of winter to discover a problem. 📞 Call EZ Comfort Air Conditioning & Heating LLC at (832) 777-0136 🌐 Visit: EZ Comfort Air Conditioning & Heating LLC⁠￼ Making Comfort EZ! #NewHomeOwner #HVACMaintenance #AirConditioning #HeatingAndCooling #IndoorAirQuality #HoustonHVAC #KingwoodTX #AtascocitaTX #HumbleTX #HomeMaintenance #EZComfort #MakingComfortEZ #PreventiveMaintenance #HVACTips","""They now service my AC unit year round for preventative maintenance."""
AMS ColdPro,https://www.google.com/maps/place/AMS+ColdPro/data=!4m7!3m6!1s0x864126a767417559:0x7ddce2c59c0adc79!8m2!3d29.7887933!4d-95.8224134!16s%2Fg%2F11bzsdbvwz!19sChIJWXVBZ6cmQYYRedwKnMXi3H0?authuser=0&hl=en&rclk=1,Closed · Opens 6:30 am Mon,Sunday: Closed||Monday: 6:30 am–7 pm||Tuesday: 6:30 am–7 pm||Wednesday: 6:30 am–7 pm||Thursday: 6:30 am–7 pm||Friday: 6:30 am–7 pm||Saturday: 6:30 am–1 pm,5,471,"5701 4th St Ste 813, Katy, TX 77493, United States",Located in: United States Postal Service,"""Responded quickly to my service request and was at my house that same morning."""
Cool Care Heating and Air Conditioning,https://www.google.com/maps/place/Cool+Care+Heating+and+Air+Conditioning/data=!4m7!3m6!1s0x8640db2b99be8955:0xe07c491b25c79dba!8m2!3d29.8086809!4d-95.5190939!16s%2Fg%2F11bycjkg5_!19sChIJVYm-mSvbQIYRup3HJRtJfOA?authuser=0&hl=en&rclk=1,Closed · Opens 8 am,Sunday: 8 am–8 pm||Monday: 8 am–8 pm||Tuesday: 8 am–8 pm||Wednesday: 8 am–8 pm||Thursday: 8 am–8 pm||Friday: 8 am–8 pm||Saturday: 8 am–8 pm,5,343,"2015 Bauer Dr, Houston, TX 77080, United States","RF5J+F9 Spring Branch Central, Houston, TX, USA","Ductless mini-split systems excel when you need targeted cooling for a specific space—such as a room that runs warmer than the rest of the home, a home office, or a new addition without existing ductwork. Because each indoor unit controls its own zone, you can fine-tune temperatures where you actually spend time and avoid overcooling the whole house. To keep efficiency high in Houston, clean or replace the unit’s filters on a regular schedule, keep the indoor air inlet and outlet clear, and ensure the outdoor unit has unobstructed airflow. Use consistent temperature settings rather than frequent swings, and select the operating mode that matches your comfort goals. If you notice reduced output, unusual noises, or water where it shouldn’t be, a professional evaluation can prevent larger issues and protect efficiency. As a family-owned HVAC Contractor, Cool Care Heating and Air Conditioning focuses on proper system placement, refrigerant management, and maintenance that help ductless systems deliver steady, comfortable cooling throughout the season."
Air Dynasty AC & Heating LLC,https://www.google.com/maps/place/Air+Dynasty+AC+%26+Heating+LLC/data=!4m7!3m6!1s0x8640b0cad8729f93:0x24cc4f8256c342b!8m2!3d29.8934019!4d-95.3095828!16s%2Fg%2F12hl13d6b!19sChIJk59y2MqwQIYRKzRsJfjETAI?authuser=0&hl=en&rclk=1,Closed · Opens 8 am Mon,Sunday: Closed||Monday: 8 am–8 pm||Tuesday: 8 am–8 pm||Wednesday: 8 am–8 pm||Thursday: 8 am–8 pm||Friday: 8 am–8 pm||Saturday: 9 am–3 pm,4.7,"2,740","5502 Northington St, Houston, TX 77039, United States","Many homeowners assume closing vents will help save energy, but your HVAC system is designed to operate with balanced airflow throughout the home. Closing vents can disrupt that balance, potentially affecting airflow, comfort, and overall system efficiency. In some cases, it may even make it harder to maintain consistent temperatures from room to room. Keeping airflow unrestricted helps support reliable performance and can be especially important for homeowners considering AC repair in Katy or investing in a new HVAC system in Montgomery. Proper airflow is one of the foundations of long-term comfort and efficiency. Serving Houston, Katy, Montgomery, and surrounding areas.","Miguel was here to do AC tune up for my house, everything went great. He's professional and very nice."
McCullough Heating & Air Conditioning,https://www.google.com/maps/place/McCullough+Heating+%26+Air+Conditioning/data=!4m7!3m6!1s0x8644cba324a66ad7:0x66ea2973ab642106!8m2!3d30.364748!4d-97.731758!16s%2Fg%2F1tdq6dlv!19sChIJ12qmJKPLRIYRBiFkq3Mp6mY?authuser=0&hl=en&rclk=1,Open 24 hours,Sunday: Open 24 hours||Monday: Open 24 hours||Tuesday: Open 24 hours||Wednesday: Open 24 hours||Thursday: Open 24 hours||Friday: Open 24 hours||Saturday: Open 24 hours,4.8,"3,454","2620 Buell Ave, Austin, TX 78757, United States","Your ducts matter more than you think. 🛠️ In Austin summers, good airflow is a big part of keeping your home comfortable. If your system is running but rooms still feel uneven, it may be time for air conditioning repair that looks at the full setup, not just the outdoor unit. McCullough Heating & Air Conditioning provides AC service for homes in Austin and surrounding areas, with careful troubleshooting and clear answers. Common signs you may need HVAC repair: • Weak airflow from vents 🌬️ • Hot spots from room to room • AC not cooling repair needs after repeated cycling • Unusual noises or rising energy use When you need air conditioner repair in Austin and surrounding areas, reach out to our HVAC contractor team and we’ll help you get back to steady, reliable comfort.","""I trust the folks at McCullough for expert service and quality equipment!"""
