business_name,gbp_url,business_hours,weekly_hours,rating,review_count,top_review_1,top_review_2,top_review_3
The Coolest LLC,https://www.google.com/maps/place/The+Coolest+LLC/data=!4m7!3m6!1s0x8644b4c40fd193c9:0x542a69120730a9d9!8m2!3d30.212917!4d-97.7601609!16s%2Fg%2F11g6rl2_w1!19sChIJyZPRD8S0RIYR2akwBxJpKlQ?authuser=0&hl=en&rclk=1,Closed · Opens 9 am,Sunday: 9 am–5 pm||Monday: 7 am–6 pm||Tuesday: 7 am–6 pm||Wednesday: 7 am–6 pm||Thursday: 7 am–6 pm||Friday: 7 am–6 pm||Saturday: 9 am–5 pm,5,845,"4505 Terry-O Ln, Austin, TX 78745, United States","Is your AC struggling to keep up with the Austin heat? Don’t wait until it completely breaks down. If your system is noisy, inefficient, or constantly needing repairs, it may be time for a professional AC replacement service in Austin TX. With temperatures rising fast, a failing system can quickly turn into an emergency. Acting early helps you avoid high energy bills and unexpected downtime. At The Coolest LLC, we make AC replacement simple and stress-free. Our experts evaluate your current system, recommend the right energy-efficient upgrade, and install it with precision. Stay cool, save money, and avoid breakdowns when you need your AC the most. Tap the Call button now and speak with our team today.","""Love the service and the work, great company and team to have in your home."""
Strand Brothers Service Experts,https://www.google.com/maps/place/Strand+Brothers+Service+Experts/data=!4m7!3m6!1s0x8644cf35ec4dce2f:0x480428152cdc1e6c!8m2!3d30.2774343!4d-97.6723608!16s%2Fg%2F1232p591w!19sChIJL85N7DXPRIYRbB7cLBUoBEg?authuser=0&hl=en&rclk=1,Open 24 hours,Sunday: Open 24 hours||Monday: Open 24 hours||Tuesday: Open 24 hours||Wednesday: Open 24 hours||Thursday: Open 24 hours||Friday: Open 24 hours||Saturday: Open 24 hours,4.8,"7,506","5811 Techni Center Dr, Austin, TX 78721, United States","Summer savings have never been so hot. Right now, existing Maintenance+ HVAC members can add on a Maintenance+ Plumbing membership and save 80% on the first year. Perks Include: ✓ Annual whole-home plumbing inspection ✓ Complimentary water heater tank flush (over $200 value) ✓ No After-Hours Service Fees ($100 savings) Don't let hours go down the drain. Leave it to the Experts! Offer valid for a limited-time only, offer ends July 31.","Justin and Hector came by and performed well with excellent customer service. They gave me a few good homeowner tips that will keep my a/c running throughout the summer and for years to come. Great job, men!"
Precision Heating & Air,https://www.google.com/maps/place/Precision+Heating+%26+Air/data=!4m7!3m6!1s0x8644cb96015e76e7:0x2ade8f623c6d4a8d!8m2!3d30.3462436!4d-97.6756502!16s%2Fg%2F1hjhc6k81!19sChIJ53ZeAZbLRIYRjUptPGKP3io?authuser=0&hl=en&rclk=1,Open 24 hours,Sunday: Open 24 hours||Monday: Open 24 hours||Tuesday: Open 24 hours||Wednesday: Open 24 hours||Thursday: Open 24 hours||Friday: Open 24 hours||Saturday: Open 24 hours,4.7,"1,633","1506 Ferguson Ln Suite 101, Austin, TX 78754, United States","Your home might look clean, but how does the air feel? If it’s dusty no matter how often you clean, feels humid or your allergies seem worse indoors, your HVAC system could be circulating more than just cool air. Pollen, pet dander, mold spores and other airborne particles can build up over time. Once they’re in your system, they keep moving through your home day after day. That’s why homeowners trust Precision Heating & Air in Austin to take a closer look. We test your indoor air quality and recommend real solutions—like advanced filtration, purification and humidity control—so you’re not just masking the problem, you’re fixing it. Because comfort isn’t just temperature. It’s what you’re breathing. 📞 Call Precision Heating & Air today to schedule an air quality check in Austin and start breathing easier at home.","""I recently placed a service call, and received service within the day."""
"Efficient AC, Electric & Plumbing","https://www.google.com/maps/place/Efficient+AC,+Electric+%26+Plumbing/data=!4m7!3m6!1s0x8644c9c902a8e355:0x4142f3a9eedb1010!8m2!3d30.383505!4d-97.716542!16s%2Fg%2F1tdwf9vn!19sChIJVeOoAsnJRIYREBDb7qnzQkE?authuser=0&hl=en&rclk=1",Open 24 hours,Sunday: Open 24 hours||Monday: Open 24 hours||Tuesday: Open 24 hours||Wednesday: Open 24 hours||Thursday: Open 24 hours||Friday: Open 24 hours||Saturday: Open 24 hours,4.8,765,"10315 Metropolitan Dr Ste A, Austin, TX 78758, United States","""The management offers a competitive price on very high quality equipment.""","""We are very happy with the service we received both at home and work."""
"Stan's Heating, Air, Plumbing & Electrical","https://www.google.com/maps/place/Stan%27s+Heating,+Air,+Plumbing+%26+Electrical/data=!4m7!3m6!1s0x8644cb906b0f3269:0x27798678bc27a547!8m2!3d30.3261449!4d-97.7181635!16s%2Fg%2F1tlndvb1!19sChIJaTIPa5DLRIYRR6UnvHiGeSc?authuser=0&hl=en&rclk=1",Open 24 hours,Sunday: Open 24 hours||Monday: Open 24 hours||Tuesday: Open 24 hours||Wednesday: Open 24 hours||Thursday: Open 24 hours||Friday: Open 24 hours||Saturday: Open 24 hours,4.7,"6,387","Stan's Heating, Air, Plumbing & Electrical","6016 Dillard Cir, Austin, TX 78752, United States","Austin homeowners get the confidence of a local pro arriving ready to fix it with Stan's. From AC repair and tankless water heater installs to whole-home surge protection and sump pump repair, our licensed techs keep your home comfortable and secure. Learn more about our 70-year legacy."
A-Plus Air Conditioning & Home Solutions,https://www.google.com/maps/place/A-Plus+Air+Conditioning+%26+Home+Solutions/data=!4m7!3m6!1s0x8644ca55f9707bbd:0xce157100eee13b23!8m2!3d30.3396426!4d-97.7416066!16s%2Fg%2F1tg9njct!19sChIJvXtw-VXKRIYRIzvh7gBxFc4?authuser=0&hl=en&rclk=1,Closed · Opens 9 am,Sunday: 9 am–6 pm||Monday: 8 am–9 pm||Tuesday: 8 am–9 pm||Wednesday: 8 am–9 pm||Thursday: 8 am–9 pm||Friday: 8 am–9 pm||Saturday: 8 am–7 pm,4.9,"1,281",A-Plus Air Conditioning & Home Solutions,"2116 White Horse Trail, Austin, TX 78757, United States","💨🏠 Build a Better Comfort Foundation With Air Duct Installation in Austin for Every Room in Your Home! 🏠💨 Rooms without ductwork end up unconditioned, making them nearly unusable on hot days no matter how hard your main unit runs. Your air conditioning system cannot reach those spaces, leaving your household relying on portable units that raise costs without solving the problem. Our HVAC technicians design a duct layout that integrates new branches into your existing system while maintaining balanced airflow throughout. We size the ductwork correctly, seal every connection and test performance before completing the installation. Adding duct access to unserved rooms brings your entire home under reliable climate control. 🌬️✨ Rely on A-Plus Air Conditioning & Home Solutions for expert air duct installation in Austin, TX and surrounding areas. 🏡🔧 Call today or visit our website to start planning your duct installation project. 🌐❄️"
Atlas AC Repair LLC,https://www.google.com/maps/place/Atlas+AC+Repair+LLC/data=!4m7!3m6!1s0x6bdaeba472369aeb:0x79757fbf5129e3ac!8m2!3d30.305835!4d-97.7431601!16s%2Fg%2F11nnzgn4kc!19sChIJ65o2cqTr2msRrOMpUb9_dXk?authuser=0&hl=en&rclk=1,Closed · Opens 7 am Mon,Sunday: Closed||Monday: 7 am–6 pm||Tuesday: 7 am–6 pm||Wednesday: 7 am–6 pm||Thursday: 7 am–6 pm||Friday: 7 am–6 pm||Saturday: 9 am–4 pm,5,481,"3800 N Lamar Blvd #200, Austin, TX 78756, United States","""Price was great, communication was great as was the finished installation.""","""His service was 5 stars and the company’s customer service is outstanding."""
Fox Service Company,https://www.google.com/maps/place/Fox+Service+Company/data=!4m7!3m6!1s0x8644b4bc7b390d41:0xab3c1d9d34bfa2c5!8m2!3d30.3462436!4d-97.6756502!16s%2Fg%2F1tkq_ngy!19sChIJQQ05e7y0RIYRxaK_NJ0dPKs?authuser=0&hl=en&rclk=1,Open 24 hours,Sunday: Open 24 hours||Monday: Open 24 hours||Tuesday: Open 24 hours||Wednesday: Open 24 hours||Thursday: Open 24 hours||Friday: Open 24 hours||Saturday: Open 24 hours,4.8,"5,289","1506 Ferguson Ln Ste #102, Austin, TX 78754, United States","Power issue out of nowhere? Searching “electrician near me” or “emergency electrician in Austin”? When something electrical goes wrong, it’s not something you can wait on. Flickering lights, tripped breakers, outlets that stop working—or worse—can disrupt your entire day and raise safety concerns fast. That’s where you can count on Fox Service Company in Austin. Our licensed electricians respond quickly, diagnose the issue and make safe, reliable repairs so you can get back to normal without the stress. From small fixes to urgent electrical problems, we’re here when you need us most. 📞 Call Fox Service Company today for fast, dependable electrical service in Austin.","If you’re searching for the best local service in Austin, Texas, I highly recommend this professional team! ⭐⭐⭐⭐⭐ As a satisfied customer in Austin, TX, I was impressed by their fast response time, honest pricing, and high-quality workmanship. Whether you need same-day service, emergency assistance, expert repair, installation, inspection, or professional consultation in Austin, Texas, they handle everything efficiently and professionally. They arrived on time, explained the process clearly, and delivered outstanding results. If you’re looking for a reliable and affordable service provider near you in Austin, this is the company to trust. Their experience, attention to detail, and commitment to customer satisfaction truly stand out in the Austin, TX local market. Highly recommended for anyone in Austin, Texas who wants dependable, professional, and top-rated local service. #AustinTexas #AustinTX #LocalBusinessAustin #AustinServices #SupportLocalAustin #TopRatedAustin #BestInAustin #AustinNearMe #FiveStarService #TrustedInAustin"
"Radiant Plumbing, Air Conditioning, & Electrical","https://www.google.com/maps/place/Radiant+Plumbing,+Air+Conditioning,+%26+Electrical/data=!4m7!3m6!1s0x8644b57df8a2a581:0x268500e22537ee48!8m2!3d30.3195055!4d-97.710867!16s%2Fg%2F1hc19vxs8!19sChIJgaWi-H21RIYRSO43JeIAhSY?authuser=0&hl=en&rclk=1",Open 24 hours,Not Found,4.8,"17,078","Radiant Plumbing, Air Conditioning, & Electrical","901 Reinli St, Austin, TX 78751, United States","Flushing a water heater is one of the simplest ways to extend its lifespan, especially in Austin where hard water causes sediment buildup over time. As sediment collects inside the tank, it can: * Reduce heating efficiency * Cause rumbling or popping noises * Shorten the lifespan of the unit The cost to flush a water heater can vary depending on the condition of the system and how much buildup is present. Routine maintenance, like annual flushing, helps avoid larger repair costs and keeps the system running efficiently. Radiant Plumbing, Air Conditioning & Electrical offers professional water heater maintenance as part of our Care Club, helping homeowners stay ahead of issues before they turn into breakdowns."
Goettl Air Conditioning and Plumbing - Austin TX,https://www.google.com/maps/place/Goettl+Air+Conditioning+and+Plumbing+-+Austin+TX/data=!4m7!3m6!1s0x8644ade321bec79f:0x3827b4837b043eed!8m2!3d30.206562!4d-97.711292!16s%2Fg%2F11n21bg1zl!19sChIJn8e-IeOtRIYR7T4Ee4O0Jzg?authuser=0&hl=en&rclk=1,Open 24 hours,Sunday: Open 24 hours||Monday: Open 24 hours||Tuesday: Open 24 hours||Wednesday: Open 24 hours||Thursday: Open 24 hours||Friday: Open 24 hours||Saturday: Open 24 hours,4.8,"3,877",Goettl Air Conditioning and Plumbing - Austin TX,"3600 Silver Dollar Cir, Austin, TX 78744, United States","Book the $299 Mini Jet service in Austin and clear stubborn clogs fast with powerful hydro jetting technology. This targeted treatment removes buildup, grease, and debris from your drains without harsh chemicals. Our team restores proper flow and prevents recurring backups. Keep your plumbing running smoothly with effective cleaning that protects your pipes and saves you money on future repairs."
"Champion Cooling, Heating & Plumbing","https://www.google.com/maps/place/Champion+Cooling,+Heating+%26+Plumbing/data=!4m7!3m6!1s0x865b4946491bac9d:0xd4787ff8ad216252!8m2!3d30.2554164!4d-97.6811797!16s%2Fg%2F1q6bkbv12!19sChIJnawbSUZJW4YRUmIhrfh_eNQ?authuser=0&hl=en&rclk=1",Open 24 hours,Sunday: Open 24 hours||Monday: Open 24 hours||Tuesday: Open 24 hours||Wednesday: Open 24 hours||Thursday: Open 24 hours||Friday: Open 24 hours||Saturday: Open 24 hours,4.8,"3,310","1106 Smith Rd Ste 102, Austin, TX 78721, United States","☀️🔧 Don’t miss our latest limited-time HVAC specials. Save on repairs, maintenance, and new system installs while these offers last.","""I highly recommend having him service your home for plumbing needs."""
Smart Air Cooling & Heating,https://www.google.com/maps/place/Smart+Air+Cooling+%26+Heating/data=!4m7!3m6!1s0x8644b49986fac18d:0x11f033ff9dd92cbf!8m2!3d30.2781844!4d-97.772563!16s%2Fg%2F1vcq7_4n!19sChIJjcH6hpm0RIYRvyzZnf8z8BE?authuser=0&hl=en&rclk=1,Closed · Opens 8 am,Sunday: 8 am–8 pm||Monday: 8 am–8 pm||Tuesday: 8 am–8 pm||Wednesday: 8 am–8 pm||Thursday: 8 am–8 pm||Friday: 8 am–8 pm||Saturday: 8 am–8 pm,4.9,695,"Austin's smart choice for home comfort — Smart Air Austin ⭐❄️ We built Smart Air Austin on one principle: treat every home like it's our own. That means honest diagnostics, upfront pricing, and a team that shows up on time and gets the job done right the first time. If you're looking for an Austin HVAC company you can actually trust, we'd love to earn your business.","Same day service after my system unexpectedly started acting up. Super friendly and helpful, very transparent with all work and pricing. Felt informed and in the loop the whole time. Technician fixed the issue very quickly and provided some … More","Meet Shane today, what a breath of fresh air he was. Very polite and knowledgeable so glad that there is a Air conditioning company out here in Kyle that is looking to great service and customer service. … More"
Gold Eagle Services,https://www.google.com/maps/place/Gold+Eagle+Services/data=!4m7!3m6!1s0x865b4a560dd9455d:0xe671d252154d91f4!8m2!3d30.2639746!4d-97.7440671!16s%2Fg%2F11f01qw_dg!19sChIJXUXZDVZKW4YR9JFNFVLSceY?authuser=0&hl=en&rclk=1,Closed · Opens 7 am Mon,Sunday: Closed||Monday: 7 am–7 pm||Tuesday: 7 am–7 pm||Wednesday: 7 am–7 pm||Thursday: 7 am–7 pm||Friday: 7 am–7 pm||Saturday: 7 am–7 pm,4.8,405,"111 Congress Ave. Ste 500, Austin, TX 78701, United States",Stay cool this summer — schedule your AC inspection now.,"""Responded quickly when the heater went out in the coldest day of the year."""
Elite Air Conditioning and Plumbing,https://www.google.com/maps/place/Elite+Air+Conditioning+and+Plumbing/data=!4m7!3m6!1s0x8644cb957f5ed557:0xddeb3f3a0bbfb58!8m2!3d30.1968138!4d-97.7047425!16s%2Fg%2F1q64fq77h!19sChIJV9Vef5XLRIYRWPu7oPOz3g0?authuser=0&hl=en&rclk=1,Open 24 hours,Sunday: Open 24 hours||Monday: Open 24 hours||Tuesday: Open 24 hours||Wednesday: Open 24 hours||Thursday: Open 24 hours||Friday: Open 24 hours||Saturday: Open 24 hours,4.9,721,"7101 Burleson Rd, Austin, TX 78744, United States","Hard-to-cool rooms need smart vent placement. Elite AC & Plumbing designs and installs HVAC vents that deliver steady airflow to every corner of your home — vaulted ceilings, additions, and tricky layouts included. Comfort, dialed in. 📞 Call Elite for a free assessment.","""I couldn't be happier with the service and the work they did."""
Austin Air Conditioning,https://www.google.com/maps/place/Austin+Air+Conditioning/data=!4m7!3m6!1s0x8644cf4980700001:0xd7a9c95c1b54ee1e!8m2!3d30.4028748!4d-97.6305463!16s%2Fg%2F11rxhzpfh1!19sChIJAQBwgEnPRIYRHu5UG1zJqdc?authuser=0&hl=en&rclk=1,Closed · Opens 9 am,Sunday: 9 am–9 pm||Monday: 7:30 am–9 pm||Tuesday: 7:30 am–9 pm||Wednesday: 7:30 am–9 pm||Thursday: 7:30 am–9 pm||Friday: 7:30 am–9 pm||Saturday: 7:30 am–9 pm,4.9,"1,365","13620 Immanuel Rd, Pflugerville, TX 78660, United States","Mini Split Installation in Austin, TX You’ve probably seen mini splits popping up around Austin—or maybe you’ve used one before and know how effective they can be. They cool without ductwork, heat when you need it, and give you control over specific spaces. What’s not always clear is how to design the right system for your home. How many zones do you need? What equipment works best? That’s where we come in. Austin Air Conditioning has years of experience installing mini splits, and we’ll build a setup that fits your home and how you use it. Reach out today for a free estimate on your mini split installation in Austin, TX.","""Great service, explained what was going on and gave reasonable options."""
Austin Refrigeration & Air Conditioning,https://www.google.com/maps/place/Austin+Refrigeration+%26+Air+Conditioning/data=!4m7!3m6!1s0x8644cbd4cad54fcf:0xf69cc5d004097efd!8m2!3d30.4140535!4d-97.7628599!16s%2Fg%2F1vhkkyk8!19sChIJz0_VytTLRIYR_X4JBNDFnPY?authuser=0&hl=en&rclk=1,Open 24 hours,Sunday: Open 24 hours||Monday: Open 24 hours||Tuesday: Open 24 hours||Wednesday: Open 24 hours||Thursday: Open 24 hours||Friday: Open 24 hours||Saturday: Open 24 hours,4.9,132,"This you in certain sections of your home? Uneven cooling can be a sign of equipment issues, busted ducts and more. If one part of the house seems perfect but others not so much, call us today before it gets real hot outside.","This company was great. Responsive, polite, on time, and great pricing.  Parker helped me with all my needs, saved me money when applicable, and it was great working with him!",Responded very fast to the call. They were both extremely nice and thorough with their job. It’s nice to know we can count on them!
RedHome HVAC Services,https://www.google.com/maps/place/RedHome+HVAC+Services/data=!4m7!3m6!1s0x645fc6677c5bb9d1:0x3c3788b206cae6f6!8m2!3d30.264926!4d-97.7282024!16s%2Fg%2F11pldtvs7w!19sChIJ0blbfGfGX2QR9ubKBrKINzw?authuser=0&hl=en&rclk=1,Open 24 hours,Sunday: Open 24 hours||Monday: Open 24 hours||Tuesday: Open 24 hours||Wednesday: Open 24 hours||Thursday: Open 24 hours||Friday: Open 24 hours||Saturday: Open 24 hours,4.9,201,"1306 E 7th St Fl 3, Austin, TX 78702, United States",The perfect thermostat setting? It's the one that fits YOUR Austin home. Constantly adjusting the temperature? Set it and forget it with a programmable model. Got family members who always feel cold? Zoning systems keep everyone happy. Call (512) 402-7277 and let our team find your perfect comfort solution.,"""Reasonably priced and, same day service."""
ABC Austin Service Express LLC,https://www.google.com/maps/place/ABC+Austin+Service+Express+LLC/data=!4m7!3m6!1s0x865b5640034e8247:0xb63d88545a302fbb!8m2!3d30.2629635!4d-97.659906!16s%2Fg%2F11c2ppbxn0!19sChIJR4JOA0BWW4YRuy8wWlSIPbY?authuser=0&hl=en&rclk=1,Open 24 hours,Sunday: Open 24 hours||Monday: Open 24 hours||Tuesday: Open 24 hours||Wednesday: Open 24 hours||Thursday: Open 24 hours||Friday: Open 24 hours||Saturday: Open 24 hours,4.9,863,"Omar and his team came out and helped us to move my outdoor unit over about 6 feet because I was going to extend my home. Omar is the best he is easy to work with and very understandable and funny too. He’s always saying jokes , He made … More","Omar and his team were absolutely great! I had a great experience with this HVAC installation. The price was very competitive, and the quality of work exceeded my expectations. The team was honest and transparent throughout the entire … More","We appreciate that, with so many HVAC companies to choose from, you chose ABC Austin Service Express to replace your HVAC unit. Your recommendation means the … More"
Blue Sky Heating and Air,https://www.google.com/maps/place/Blue+Sky+Heating+and+Air/data=!4m7!3m6!1s0x8644cf2fb9145649:0x849c72bf6a600fdf!8m2!3d30.3415589!4d-97.7549546!16s%2Fg%2F11g8rckfh0!19sChIJSVYUuS_PRIYR3w9gar9ynIQ?authuser=0&hl=en&rclk=1,Open 24 hours,Sunday: Open 24 hours||Monday: Open 24 hours||Tuesday: Open 24 hours||Wednesday: Open 24 hours||Thursday: Open 24 hours||Friday: Open 24 hours||Saturday: Open 24 hours,4.7,387,"5900 Balcones Dr STE 5090, Austin, TX 78731, United States","""Once the issue was diagnose Blue Sky quickly located and ordered the part.""","""Been with them through our home warranty and regular service."""
"Abacus Plumbing, Air Conditioning, & Electrical","https://www.google.com/maps/place/Abacus+Plumbing,+Air+Conditioning,+%26+Electrical/data=!4m7!3m6!1s0x8644cb0f3dfef38b:0x437ed427aa9e3392!8m2!3d30.3860209!4d-97.7132636!16s%2Fg%2F11mwtk_xhl!19sChIJi_P-PQ_LRIYRkjOeqifUfkM?authuser=0&hl=en&rclk=1",Open 24 hours,Sunday: Open 24 hours||Monday: Open 24 hours||Tuesday: Open 24 hours||Wednesday: Open 24 hours||Thursday: Open 24 hours||Friday: Open 24 hours||Saturday: Open 24 hours,4.8,"5,962","Abacus Plumbing, Air Conditioning, & Electrical","2106 Denton Dr, Austin, TX 78758, United States","Award-Winning Service Since 2003 Recognized by BBB, Angie's List, and Home Advisor! Consistent quality, honest service, and customer satisfaction drive everything we do in Austin. #TrustedService"
Daniel's Plumbing and Air Conditioning,https://www.google.com/maps/place/Daniel%27s+Plumbing+and+Air+Conditioning/data=!4m7!3m6!1s0x8644cb8df39186c7:0xf1c81d387e36d2c6!8m2!3d30.3809983!4d-97.7281048!16s%2Fg%2F11bzs3h_24!19sChIJx4aR843LRIYRxtI2fjgdyPE?authuser=0&hl=en&rclk=1,Not Found,Not Found,4.7,"2,809","2929 Longhorn Blvd #105, Austin, TX 78758, United States","Noticed a leak? That small drip under the sink or damp spot on the wall might not seem urgent, but leaks have a way of turning into bigger problems fast. Water damage, mold and higher utility bills can all start from something minor. That’s why homeowners count on Daniel's in Austin for fast, reliable plumbing repairs. Our licensed plumbers can quickly find the source, fix the issue and help prevent further damage—so you don’t end up dealing with a much bigger (and more expensive) repair down the line. Don’t wait until it gets worse. 📞 Call Daniel's today to schedule leak repair in Austin and get it fixed fast.","""He gave me a variety of options with prices and never pushed any repair."""
ABA Heating and Cooling,https://www.google.com/maps/place/ABA+Heating+and+Cooling/data=!4m7!3m6!1s0x8644cbac1ee0946d:0x54df69d66181afcd!8m2!3d30.3505981!4d-97.7351198!16s%2Fg%2F11bxg_g1h6!19sChIJbZTgHqzLRIYRza-BYdZp31Q?authuser=0&hl=en&rclk=1,Open 24 hours,Sunday: Open 24 hours||Monday: Open 24 hours||Tuesday: Open 24 hours||Wednesday: Open 24 hours||Thursday: Open 24 hours||Friday: Open 24 hours||Saturday: Open 24 hours,4.7,294,"2409 Richcreek Rd #2, Austin, TX 78757, United States","🔧 Thinking about replacing your HVAC system? “Kelvin Cordero came out to do an estimate for a new unit. He was very courteous and helpful with all the questions I asked. Very professional… ask for him!” – Angie B. Whether you’re comparing options or ready to upgrade, our team is here to guide you — with zero pressure and total professionalism. ✅ Honest system recommendations ✅ Clear, helpful answers ✅ Trusted pros like Kelvin on every call 👉 Schedule a quote at https://zurl.co/7CRTf #ABAHVAC #AustinHVAC #HVACReplacement #HVACEstimate #KelvinGetsItDone #CustomerPraise #FiveStarService #NewACSystem","""Chad diagnosed problem in morning ordered technician through Jason."""
"Service Wizard Air Conditioning, Heating, and Plumbing","https://www.google.com/maps/place/Service+Wizard+Air+Conditioning,+Heating,+and+Plumbing/data=!4m7!3m6!1s0x8644ce92b4ff24e7:0x8fed4e794c9358b8!8m2!3d30.566549!4d-97.5691864!16s%2Fg%2F1tgjlpdn!19sChIJ5yT_tJLORIYRuFiTTHlO7Y8?authuser=0&hl=en&rclk=1",Closed · Opens 12 pm,Sunday: 12–5 pm||Monday: 7:30 am–6 pm||Tuesday: 7:30 am–6 pm||Wednesday: 7:30 am–6 pm||Thursday: 7:30 am–6 pm||Friday: 7:30 am–6 pm||Saturday: 8 am–5 pm,4.9,"2,025","Service Wizard Air Conditioning, Heating, and Plumbing","132 TK Industrial Blvd, Hutto, TX 78634, United States","What company offers ways to save on plumbing or AC repair services? Service Wizard is well-known throughout Round Rock for providing honest, high-quality work at a fair price. While we always strive to offer great value to every neighbor, joining the Wizard Rewards Membership is a smart evolution of our service that offers exclusive discounts on HVAC and plumbing repairs and diagnostics. You still get the trustworthy craftsmanship you expect from our team, just with added member savings that often result in the program paying for itself after just one visit. Call Now to join Wizard Rewards Membership!"
SALT Plumbing Air & Electric,https://www.google.com/maps/place/SALT+Plumbing+Air+%26+Electric/data=!4m7!3m6!1s0xa610ec2fd3919759:0xbd080495e4a102d6!8m2!3d30.2645279!4d-97.7821244!16s%2Fg%2F11k3g2wxz3!19sChIJWZeR0y_sEKYR1gKh5JUECL0?authuser=0&hl=en&rclk=1,Closed · Opens 8 am,Sunday: 8 am–8 pm||Monday: 8 am–8 pm||Tuesday: 8 am–8 pm||Wednesday: 8 am–8 pm||Thursday: 8 am–8 pm||Friday: 8 am–8 pm||Saturday: 8 am–8 pm,4.9,"1,498","901 S MoPac Expy, Austin, TX 78746, United States","Home repairs shouldn’t wait because of cost. With easy, affordable financing options from SALT, you can move forward with needed HVAC, plumbing, or electrical services today and spread payments out over time. It’s a simple way to keep your home comfortable and safe without the upfront burden. Reach out to get started!","""Genuinely the best service and the sweetest people!!"""
