business_name,gbp_url,business_hours,weekly_hours,rating,review_count,top_review_1,top_review_2,top_review_3
Infinity AC of Austin,https://www.google.com/maps/place/Infinity+AC+of+Austin/data=!4m7!3m6!1s0xaad258b191a7e0fd:0xe8f1d794aa0e5d15!8m2!3d30.2403369!4d-98.0188181!16s%2Fg%2F11ltqdldnl!19sChIJ_eCnkbFY0qoRFV0OqpTX8eg?authuser=0&hl=en&rclk=1,Open 24 hours,Not Found,5,264,"171 Preslar Cir, Austin, TX 78736, United States",Frank and Robert came to temple Texas and  did a great job installing my new Goodman heatpump system. Very  knowledgeable and professional. Infinity ac of Austin is the one to call for all your air conditioning needs..... … More,"Infinity employees-Frank and Chase were very professional. talked to me about what was going to happen with the repairs, very friendly, cleaned up after their work was done., they did a great job. my AC/Heater works so well! so Happy I … More"
AC Superheroes,https://www.google.com/maps/place/AC+Superheroes/data=!4m7!3m6!1s0x865b316582516681:0x54e221b74282ed76!8m2!3d30.379592!4d-97.9511823!16s%2Fg%2F11t52d9y40!19sChIJgWZRgmUxW4YRdu2CQrch4lQ?authuser=0&hl=en&rclk=1,Open 24 hours,Sunday: Open 24 hours||Monday: Open 24 hours||Tuesday: Open 24 hours||Wednesday: Open 24 hours||Thursday: Open 24 hours||Friday: Open 24 hours||Saturday: Open 24 hours,4.9,289,"1305 Buffalo Gap Rd, Austin, TX 78734, United States","""They saved my life!"" This feedback highlights our commitment to prompt service. If your air conditioning fails, especially during the sweltering summer months, know that AC Superheroes is right here in Austin, ready to respond swiftly. Our team arrived early Saturday morning to ensure comfort was restored without delay. If your unit shows signs of struggling, don’t wait—service it now to guarantee a cool home during the summer heat like Taylor Kenis did!","""Great communication and service- would highly recommend!"""
Chuck's Air Conditioning,https://www.google.com/maps/place/Chuck%27s+Air+Conditioning/data=!4m7!3m6!1s0x865b525f7c3c99d3:0xe902631c5b1459c1!8m2!3d30.1197491!4d-97.8841602!16s%2Fg%2F11dfv_sl83!19sChIJ05k8fF9SW4YRwVkUWxxjAuk?authuser=0&hl=en&rclk=1,Closed · Opens 7:30 am Mon,Sunday: Closed||Monday: 7:30 am–8 pm||Tuesday: 7:30 am–8 pm||Wednesday: 7:30 am–8 pm||Thursday: 7:30 am–8 pm||Friday: 7:30 am–8 pm||Saturday: 8 am–4 pm,5,591,"55 Country Oaks Dr, Buda, TX 78610, United States","""Staff member Jarrod arrived on time and provided great service at a great price!""","""I really appreciate doing business with a locally owned family oriented company."""
Platinum Air Heating & Cooling,https://www.google.com/maps/place/Platinum+Air+Heating+%26+Cooling/data=!4m7!3m6!1s0x865b2f56d777018d:0x207ea43ed62ddaee!8m2!3d30.4285086!4d-97.6765793!16s%2Fg%2F11j5zp12h6!19sChIJjQF311YvW4YR7tot1j6kfiA?authuser=0&hl=en&rclk=1,Open 24 hours,Sunday: Open 24 hours||Monday: Open 24 hours||Tuesday: Open 24 hours||Wednesday: Open 24 hours||Thursday: Open 24 hours||Friday: Open 24 hours||Saturday: Open 24 hours,4.8,78,"1605 Hydro Dr, Austin, TX 78728, United States","As summer heatwaves hit Cedar Park and Round Rock, ensure your HVAC system is ready! ✔️ Check filters monthly to maintain airflow. 🌬️ Inspect your outdoor unit for debris and clear it away. 🚧 For winter, consider a pre-season checkup to prevent freeze-ups! 🥶 Schedule your HVAC maintenance today to enjoy comfort year-round! Contact Platinum Air Heating & Cooling! 👍","""Excellent service, quality work, and great overall experience."""
Capitol Cooling LLC,https://www.google.com/maps/place/Capitol+Cooling+LLC/data=!4m7!3m6!1s0x818d7f4695f8685b:0x49000b4525603338!8m2!3d30.1289155!4d-97.762967!16s%2Fg%2F11kb5gffv3!19sChIJW2j4lUZ_jYERODNgJUULAEk?authuser=0&hl=en&rclk=1,Closed · Opens 8 am Mon,Sunday: Closed||Monday: 8 am–6 pm||Tuesday: 8 am–6 pm||Wednesday: 8 am–6 pm||Thursday: 8 am–6 pm||Friday: 8 am–6 pm||Saturday: Closed,4.9,151,"Dust accumulation, component wear, and airflow restrictions can gradually reduce HVAC performance. Experienced HVAC service Austin, TX helps maintain proper system function through routine evaluations and corrective service. Capitol Cooling supports properties that require ongoing HVAC attention.","Scott Clark was very nice, diagnosed our problem, and fixed it quickly. He also explained what had gone wrong. We are very happy with your service and will call you again when a need arises.","These guys are amazing! Bottom line - call them if you need service, but absolutely call them if you need your unit replaced! It isn't often that everyone you interact with at a company is amazing. Katie is your first line of contact and … More"
Alpine Heating & Air Conditioning,https://www.google.com/maps/place/Alpine+Heating+%26+Air+Conditioning/data=!4m7!3m6!1s0x8644cb9622becf43:0xdb75f99757ea2077!8m2!3d30.3447804!4d-97.68545!16s%2Fg%2F11bbrjc3d0!19sChIJQ8--IpbLRIYRdyDqV5f5dds?authuser=0&hl=en&rclk=1,Closed · Opens 7 am,Sunday: 7 am–7 pm||Monday: 7 am–7 pm||Tuesday: 7 am–7 pm||Wednesday: 7 am–7 pm||Thursday: 7 am–7 pm||Friday: 7 am–7 pm||Saturday: 7 am–7 pm,4.9,59,"1205 Sheldon Cove Bldg 2, Ste J, Austin, TX 78753, United States","Time for a new A/C system install or a major change-out? 🚛🏗️ Alpine Heating & Air Conditioning handles installs with the right equipment and a careful plan, so your home stays comfortable and your system runs efficiently. We help homeowners across Austin, Round Rock, Westlake, Bee Cave, Cedar Park, Lakeway, and The Hills with everything from full replacements to follow-up Air Conditioning Repair and HVAC Repair when something isn’t working right. If you’ve been searching “HVAC Repair Near Me,” we’re local and ready to help. ✔ Install planning and system sizing 🧰 Heat pump and AC installs 🌬️ Indoor airflow and comfort checks 🔧 Post-install tune-ups and maintenance options Need a quote or want to schedule service? Reach out to Alpine Heating & Air Conditioning today.","""I highly recommend this locally owned company and their employees."""
Youngs HVAC Pros,https://www.google.com/maps/place/Youngs+HVAC+Pros/data=!4m7!3m6!1s0x8644b2588bef53d3:0xc61ccad11068f73b!8m2!3d30.328429!4d-97.7264094!16s%2Fg%2F11c1n8jscp!19sChIJ01Pvi1iyRIYRO_doENHKHMY?authuser=0&hl=en&rclk=1,Closed · Opens 9 am Mon,Sunday: Closed||Monday: 9 am–5 pm||Tuesday: 9 am–5 pm||Wednesday: 9 am–5 pm||Thursday: 9 am–5 pm||Friday: 9 am–5 pm||Saturday: Closed,4.9,358,"Chris was truly amazing—I can’t recommend him enough! He figured out the problem right away, fixed it quickly, and even dealt with my warranty company to make sure I got refunded for the overcharge. He made the whole process so easy. Highly recommend!","On time, great price, professional.  Installed mini split in garage. Glad I made the improvement. Happy I was referred to Chris.",Amazing team . Chris and his team found the  . issue in not time . Ordered the part trough expedited delivery with no extra charge and helped restore the AC back as soon as the part arrived
new Universal HVAC Contractors Austin.,https://www.google.com/maps/place/new+Universal+HVAC+Contractors+Austin./data=!4m7!3m6!1s0x8644cf769b3e2ad7:0xf9f8e4e98e7ab444!8m2!3d30.4058222!4d-97.6375304!16s%2Fg%2F11gy381ws7!19sChIJ1yo-m3bPRIYRRLR6junk-Pk?authuser=0&hl=en&rclk=1,Open 24 hours,Sunday: Open 24 hours||Monday: Open 24 hours||Tuesday: Open 24 hours||Wednesday: Open 24 hours||Thursday: Open 24 hours||Friday: Open 24 hours||Saturday: Open 24 hours,5,3,"911 Dessau Rd, Austin, TX 78753, United States",Was looking for a reliable heating and air conditioning company because my last one I could never count on.  Found these guys online and couldn't be happier.  Will use again!,"After a previous negative experience with another contractor, I was relieved when the HVAC technician arrived promptly and identified the issue with my ventilated ceiling as a misaligned vent cover, which they fixed efficiently in about an … More"
Green Collar Operations,https://www.google.com/maps/place/Green+Collar+Operations/data=!4m7!3m6!1s0x8644c9a472d46c5d:0x528495cae0262408!8m2!3d30.3704444!4d-97.7389776!16s%2Fg%2F1tjxg175!19sChIJXWzUcqTJRIYRCCQm4MqVhFI?authuser=0&hl=en&rclk=1,Closed · Opens 8:30 am Mon,Sunday: Closed||Monday: 8:30 am–4:30 pm||Tuesday: 8:30 am–4:30 am||Wednesday: 8:30 am–4:30 pm||Thursday: 8:30 am–4:30 pm||Friday: 8:30 am–4:30 pm||Saturday: Closed,4.8,65,"8500 Shoal Creek Blvd #2l, Austin, TX 78757, United States","""I highly recommend Green Collar for home insulation and HVAC work/services.""","""We just had Green Collar put in new duct-work and insulation."""
Cool Champs Inc.,https://www.google.com/maps/place/Cool+Champs+Inc./data=!4m7!3m6!1s0x8644b5ab5613cccb:0x972c40829c39efe!8m2!3d30.2108575!4d-97.725811!16s%2Fg%2F11q35_852r!19sChIJy8wTVqu1RIYR_p7DKQjEcgk?authuser=0&hl=en&rclk=1,Open 24 hours,Sunday: Open 24 hours||Monday: Open 24 hours||Tuesday: Open 24 hours||Wednesday: Open 24 hours||Thursday: Open 24 hours||Friday: Open 24 hours||Saturday: Open 24 hours,5,58,"5214 Burleson Rd STE 509, Austin, TX 78744, United States","""Also gave us very honest pricing, and top-tier service!""","""Very thorough in explaining the entire process and options."""
LOA Construction and Austin Roofing,https://www.google.com/maps/place/LOA+Construction+and+Austin+Roofing/data=!4m7!3m6!1s0x8644b487bf65282f:0xf8e94d6ddfb92346!8m2!3d30.228311!4d-97.77025!16s%2Fg%2F11ffv32yj8!19sChIJLyhlv4e0RIYRRiO5321N6fg?authuser=0&hl=en&rclk=1,Open 24 hours,Sunday: Open 24 hours||Monday: Open 24 hours||Tuesday: Open 24 hours||Wednesday: Open 24 hours||Thursday: Open 24 hours||Friday: Open 24 hours||Saturday: Open 24 hours,5,991,LOA Roofing & Construction | Local Storm Repair Experts,Storm damage repair you can trust. We work with your insurance every step of the way.,"706 W Ben White Blvd Ste 200B, Austin, TX 78704, United States"
MCS Austin,https://www.google.com/maps/place/MCS+Austin/data=!4m7!3m6!1s0x8644cd2e1f2e1d91:0xb2a204586c525c81!8m2!3d30.43667!4d-97.771765!16s%2Fg%2F1tscpdgf!19sChIJkR0uHy7NRIYRgVxSbFgEorI?authuser=0&hl=en&rclk=1,Closed · Opens 8 am Mon,Sunday: Closed||Monday: 8 am–5 pm||Tuesday: 8 am–5 pm||Wednesday: 8 am–5 pm||Thursday: 8 am–5 pm||Friday: 8 am–5 pm||Saturday: Closed,4.7,227,"12885 Research Blvd Suite 102A, Austin, TX 78750, United States","🌸 THIS MOTHER’S DAY… GIVE MOM A BACKYARD SHE CAN ACTUALLY ENJOY 🌸 Tired of mosquitoes, flies, and bugs ruining family time outside? This year, skip the flowers… and give Mom something that lasts all summer 💝 Introducing Mosquito Misting Systems from MCS Austin — the ultimate gift for a bug-free backyard. 💐 PERFECT FOR MOTHER’S DAY ✔️ Enjoy peaceful mornings & relaxing evenings outside ✔️ Protect your family from mosquitoes, flies, spiders & more ✔️ Easy DIY install — no hassle ✔️ Do your own refills & save money ✔️ Organic insecticide options available 🌿 ✔️ Automated systems = more time with family 🚫 No more sprays that wear off in minutes ✔️ Get long-lasting protection with 80–90% insect reduction Make your patio, backyard, or outdoor kitchen a place Mom actually wants to be ❤️ 🎁 Give the gift of comfort, protection, and outdoor living 👉 Learn more: http://www.mcsaustin.com 📞 512-844-8498 We also install louvered pergolas and outdoor kitchens!!","""Great staff, excellent services, reasonable prices, awesome quality."""
"Frostymist Air Conditioning & Heating, LLC","https://www.google.com/maps/place/Frostymist+Air+Conditioning+%26+Heating,+LLC/data=!4m7!3m6!1s0xab6bbf05f5f8ea45:0x60d303e995a455f2!8m2!3d30.1743376!4d-97.7579772!16s%2Fg%2F11pd21v6j8!19sChIJRer49QW_a6sR8lWklekD02A?authuser=0&hl=en&rclk=1",Closed · Opens 7 am,Sunday: 7 am–9 pm||Monday: 7 am–9 pm||Tuesday: 7 am–9 pm||Wednesday: 7 am–9 pm||Thursday: 7 am–9 pm||Friday: 7 am–9 pm||Saturday: Closed,4.9,188,"Frostymist Air Conditioning & Heating, LLC","4615 Borage Dr, Austin, TX 78744, United States","On a sweltering Sunday, we swiftly replaced a dead blower motor, restoring cool comfort for tenants in South Austin."
Awesome Air & Heat Service,https://www.google.com/maps/place/Awesome+Air+%26+Heat+Service/data=!4m7!3m6!1s0x8644cb1af0b3007b:0xc0574fd19244c1a!8m2!3d30.4140535!4d-97.7670541!16s%2Fg%2F1vd71qfq!19sChIJewCz8BrLRIYRGkwkGf10BQw?authuser=0&hl=en&rclk=1,Closed · Opens 7 am Mon,Sunday: Closed||Monday: 7 am–7 pm||Tuesday: 7 am–7 pm||Wednesday: 7 am–7 pm||Thursday: 7 am–7 pm||Friday: 7 am–7 pm||Saturday: Closed,4.9,178,We had a great experience with Awesome Air.  I did a lot of research on this before going with Awesome Air.  They installed a new AC unit along with a new furnace and thermostat.  Pattie and Mark kept me updated on my order as it … More,"Mark and Awesome air have been servicing my HVAC systems for over 10 years.  About 6 years back, Mark and Awesome Air replaced my lower HVAC system.  This summer, while I had guests in town for a wedding, my upstairs unit starting acting … More","Frank, our community deserves the best, and we're thrilled you're a part of it. It's been our pleasure to help you these past 10 years, and we look forward to the years to come. Helping you with a smile and paying attention to the details, … More"
ARS / Rescue Rooter,https://www.google.com/maps/place/ARS+%2F+Rescue+Rooter/data=!4m7!3m6!1s0x8644ce8627d15419:0x6d0ca554f18d5626!8m2!3d30.3388241!4d-97.6707886!16s%2Fg%2F1tgj96d0!19sChIJGVTRJ4bORIYRJlaN8VSlDG0?authuser=0&hl=en&rclk=1,Open 24 hours,Not Found,4.4,"5,042","8619 Wall St Ste 600, Austin, TX 78754, United States","""My technician, Miguel provided excellent service and solved our plumbing issue.""","""He didn't set the thermostat back when he finished and now the app doesn't work."""
Grande Air Solutions,https://www.google.com/maps/place/Grande+Air+Solutions/data=!4m7!3m6!1s0x8644db9526504235:0xb9d0748f05124019!8m2!3d30.449178!4d-97.6537981!16s%2Fg%2F11bbrpjv1p!19sChIJNUJQJpXbRIYRGUASBY900Lk?authuser=0&hl=en&rclk=1,Closed · Opens 12 am Mon,Sunday: Closed||Monday: Open 24 hours||Tuesday: Open 24 hours||Wednesday: Open 24 hours||Thursday: Open 24 hours||Friday: Open 24 hours||Saturday: Open 24 hours,4.8,611,"2512 W Pecan St #320, Pflugerville, TX 78660, United States","✔️Indoor Air Quality Services Indoor air quality plays an important role in home comfort and system performance. We provide professional indoor air quality services for homes in Pflugerville, Round Rock, and Hutto, including UV sanitizers and air handler solutions designed to help reduce airborne contaminants and improve airflow. ☎️Contact us to book a service https://grandeairsolutions.com/contact/","""Great service, attention to detail and pricing!"""
Austin's Green Air & Heating,https://www.google.com/maps/place/Austin%27s+Green+Air+%26+Heating/data=!4m7!3m6!1s0x8644b2d54293f35d:0x76548cd185c87b42!8m2!3d30.1548943!4d-97.8151194!16s%2Fg%2F1hc299_g6!19sChIJXfOTQtWyRIYRQnvIhdGMVHY?authuser=0&hl=en&rclk=1,Closed · Opens 8 am Mon,Sunday: Closed||Monday: 8 am–6 pm||Tuesday: 8 am–6 pm||Wednesday: 8 am–6 pm||Thursday: 8 am–6 pm||Friday: 8 am–6 pm||Saturday: Closed,4.8,108,"708 Fort Chadbourne Dr, Austin, TX 78748, United States","""Small enough company to give you personalized attention and service.""","""The price was very competitive and the work was done efficiently."""
Quality Living Services,https://www.google.com/maps/place/Quality+Living+Services/data=!4m7!3m6!1s0x8644cbd2e1d515b7:0xb48464623f05ec64!8m2!3d30.3487051!4d-97.7062537!16s%2Fg%2F1td6gwmc!19sChIJtxXV4dLLRIYRZOwFP2JkhLQ?authuser=0&hl=en&rclk=1,Closed · Opens 8 am Mon,Sunday: Closed||Monday: 8 am–7 pm||Tuesday: 8 am–7 pm||Wednesday: 8 am–7 pm||Thursday: 8 am–7 pm||Friday: 8 am–7 pm||Saturday: 8 am–7 pm,4.8,290,"501 W Powell Ln #322, Austin, TX 78753, United States","Quality Living Services is your go-to HVAC contractor in Austin, TX. We specialize in both residential and commercial HVAC services. Whether you need installation, maintenance, or repairs, we've got you covered. Contact us today! http://www.qualitylivingservices.com/","""Their service techs are very nice, polite and knowledgable."""
Totally Cool Heating & Air,https://www.google.com/maps/place/Totally+Cool+Heating+%26+Air/data=!4m7!3m6!1s0x8644ca478c7379cd:0xe4c5a4f233b8ee4!8m2!3d30.3762475!4d-97.6927959!16s%2Fg%2F1td38mst!19sChIJzXlzjEfKRIYR5I47I09aTA4?authuser=0&hl=en&rclk=1,Closed · Opens 8 am Mon,Sunday: Closed||Monday: 8 am–5 pm||Tuesday: 8 am–5 pm||Wednesday: 8 am–5 pm||Thursday: 8 am–5 pm||Friday: 8 am–5 pm||Saturday: Closed,4.7,69,"909 Mc Phaul St, Austin, TX 78758, United States","""Communication with the company and customer service was terrific.""","""Great people, fair pricing, and outstanding workmanship."""
AC Pros Air Conditioning & Plumbing,https://www.google.com/maps/place/AC+Pros+Air+Conditioning+%26+Plumbing/data=!4m7!3m6!1s0x865b2d71776d3f5b:0x82ccd1aba926745a!8m2!3d30.4281214!4d-97.6720707!16s%2Fg%2F113g32k7x!19sChIJWz9td3EtW4YRWnQmqavRzII?authuser=0&hl=en&rclk=1,Closed · Opens 7:30 am Mon,Sunday: Closed||Monday: 7:30 am–7 pm||Tuesday: 7:30 am–7 pm||Wednesday: 7:30 am–7 pm||Thursday: 7:30 am–7 pm||Friday: 7:30 am–7 pm||Saturday: 8 am–4 pm,4.9,441,"13900 N Interstate Hwy 35 Ste J1, Austin, TX 78728, United States","A new return duct was installed on the dehumidifier, enhancing HVAC efficiency for the homeowner's comfort.","""Communication was fast, price was fair and service exceeded expectations."""
Alamo Austin Air Conditioning & Heating,https://www.google.com/maps/place/Alamo+Austin+Air+Conditioning+%26+Heating/data=!4m7!3m6!1s0x865b4c5fc16f3d83:0x3bf65e6d620f9cb6!8m2!3d30.2388821!4d-97.934397!16s%2Fg%2F11cs4g4dg4!19sChIJgz1vwV9MW4YRtpwPYm1e9js?authuser=0&hl=en&rclk=1,Closed · Opens 8 am,Sunday: 8 am–2 pm||Monday: 8 am–6 pm||Tuesday: 8 am–6 pm||Wednesday: 8 am–6 pm||Thursday: 8 am–6 pm||Friday: 8 am–6 pm||Saturday: 8 am–2 pm,5,"1,035","8819 Jim Davis Pl, Austin, TX 78736, United States","""Great work done on replacing AC/furnace, duct work, and insulation.""","""Couldn’t be happier with the prompt and professional service we received!"""